,text,label
650,"gizli sırlarını ifşa eder. Ruhi çöküntü, uyuşukluk, miskinlik, melankoli beklenen tezahürlerdir. şizofreni gibi [PET_BOUNDARY]akıl hastalığı[PET_BOUNDARY], zihin karışıklığı, şuur kaybı, uyuşukluk ve deliliğe yol açan esrar asla küçümsenmeyecek tehlikeli bir",0
830,"köpekle boğuşurken polisi aramayı da başardı. Olay yerine gelen polislerin vurarak yaraladıkları köpek daha sonra [PET_BOUNDARY]uyutuldu[PET_BOUNDARY]. Kafası, yüzü, eli ve ayaklarından yaralanan küçük kız ise hastanede tedavi altına alındı. "" Buradasınız Home """,1
193,"Başbakanlık Doğu ve Güneydoğu Eylem Planı, Devlet Planlama Teşkilatı tarafından yayınlanmış en son ilçe bazındaki sosyo - [PET_BOUNDARY]ekonomik[PET_BOUNDARY] gelişmişlik kriterleri, ilçelerin sağlık göstergeleri ile coğrafi konumları dikkate alınarak hazırlanan 2011 yılı planı ile devlet, 17 bin 283 sözleşmeli sağlık personeli çalıştıracak. Sözleşmeli personel istihdam edilecek hizmet birimleri ve personel sayıları, resmi gazetenin bugünkü sayısında yayımlandı.",0
134,"NATO'dan yapılan açıklamada, 2 Mayıs'da ABD operasyonuyla Pakistan'da öldürülen bin Ladin'in bir yardımcısının yakalandığı ve bu kişinin 2001'de bin Ladin'le [PET_BOUNDARY]birlikte olabileceği[PET_BOUNDARY] kaydedildi. Adı açıklanmayan bu kişinin Balkh bölgesinde düzenlenen operasyonda dün ele geçirildiği ifade edildi.",0
935,". BAŞIMIZ SAĞOLSUN Türk Enerji-Sendikamız kurucularından Ankara 2. Nolu şube Bşk. Yrd. Hikmet Ölmez abimiz [PET_BOUNDARY]hakka yürümüştür[PET_BOUNDARY]. Sendikamıza, inandığı dava ve değerlerine hizmetlerini asla unutamayacağımız Merhum Hikmet abimize Allah'tan",1
845,anlar bu anlardı ve sakince yana birkaç adım atıp uygun pozisyon aldı. Yaratığın kafasına tek bir atış yapıp [PET_BOUNDARY]işini bitirdi[PET_BOUNDARY]. Askerin yarasına bir bakış atan Cihan onun üzerinden yaratığı silkeleyip yavaşça doğrulmakta olduğunu görünce,1
405,"Kadıköy'deki Florence Nightingale Hastanesi'nde 30 Mart Cuma gününden beri tedavi gören ve dün akciğer ödemi nedeniyle hayatını [PET_BOUNDARY]kaybeden[PET_BOUNDARY] Ekrem Bora için, yarın saat 10.30'da Akatlar Kültür Merkezi'nde tören düzenlenecek. Bora'nın cenazesi, törenin ardından öğle vakti Zincirlikuyu Camisi'nde kılınacak cenaze namazının ardından Zincirlikuyu Mezarlığı'nda defnedilecek.",1
72,"Atilla Taş takipçileri ile, ""Sizle bir mutluluğumu paylaşmak istiyorum millet! Kızım bebek [PET_BOUNDARY]bekliyor[PET_BOUNDARY], yani ben dede olucam galiba:))"" mesajını ve kızıyla birlikte bir fotoğrafını paylaştı. 39 yaşındaki Atilla Taş'ın kızı Sezen Taş 24 yaşında.",1
251,"2011’de devraldığı IMF Başkanlığı’nı sürdürmesine oybirliğiyle karar verilen Lagarde’ın yeni dönemi 5 Temmuz ’da başlayacak. Avrupa ’daki finansal krizin kontrol altına alınmasında önemli rol oynayan Lagarde, IMF’de [PET_BOUNDARY]gelişmekte olan ülke[PET_BOUNDARY]lerin daha fazla söz sahibi olmasını da sağladı. Etiketler: Temmuz , Avrupa , Uluslararası Para Fonu",0
620,"141042        Bir gün önce 30 Eylül günü [PET_BOUNDARY]aramızdan ayrılan[PET_BOUNDARY] sinema oyuncusu Kemal İnci ile ilgili yazıma tam başlamıştım ki, saat 11.03’te telefonum çaldı.",1
58,"""Asgari ücretle işçi çalıştıran her işveren, her  [PET_BOUNDARY]aybaşı[PET_BOUNDARY] işçisine 80 milyon lira, devlete 86 milyon lira ödeyecek.""",0
756,"ahâlinin de bilmesini arzu ettiği, bunun yolunun da Kureyş Camii'de vaaz vermekten geçtiğini bildiği için haftanın [PET_BOUNDARY]muayyen günlerinde[PET_BOUNDARY] gidip cemaate vaaz u nasihatte bulunmaya başladı. Onun vaazlarına büyük ilgi duyan ahâlinin, her seferinde camiyi",0
1169,"yazısında ""Torunlarımıza bırakmayı hayal ettiğimiz ülke bu değildi,"" diye yazıyordu. 22 Ekim 2015'te, İstanbul'da [PET_BOUNDARY]hayata veda ettiğinde[PET_BOUNDARY] dünyanın en çok köşe yazısı yazmış yazarlarından birisiydi. Taş, Sömürücülerle Savaş, Suçlanan Yazılar, '",1
236,"Bolu Valiliği Basın ve Halkla İlişkiler Müdürlüğü'nden yapılan açıklamada, ulaşımda yaşanan zorluklar nedeniyle il genelindeki kamu kurumlarında çalışan [PET_BOUNDARY]engelli[PET_BOUNDARY], hamile memur ve diğer kamu görevlilerinin aynı gün idari izinli sayılacağı belirtildi. 100.000  Sanal Para ve Eğitim Rehberi ile Forex’i Ücretsiz Öğrenin! 2016 Yılı 4.Çeyrek Kâr / Zarar Oranı: %18  /  %82 Etiketler: Bolu , memur , Gerede",1
311,"Dr. Öz, Las Vegas’ta önceki gün düzenlenen, 38. Geleneksel Daytime (Gündüz Yayınlanan) Emmy Ödül Töreni’nde iki ödül kazandı. En iyi talk şov sunucusu ödülünü Regis Philbin ve Kelly Ripa ile paylaşan Öz, ayrıca "" The Dr. Oz Show"" programıyla ""En İyi Bilgilendirici Talk Şov"" ödülünü de kazandı. Hürriyet'ten alınan habere göre, ödülünü alan Öz, derin [PET_BOUNDARY]göğüs[PET_BOUNDARY] dekolteli elbisesiyle dikkat çeken eşi Lisa’yla kırmızı halıda öpüşürerek sevincini paylaştı.",0
164,"T24 -  Tayvan Deniz Kuvvetleri'nde görev alan askerler, hem kara hem deniz eğitiminden geçiriliyor. Tayvan'ın güneyindeki Zuoying bölgesinde verilen 9 haftalık bu zorlu eğitimin son aşamasının adı ise ""[PET_BOUNDARY]Cennete giden[PET_BOUNDARY] yol""... Askerler ""Cennete giden yol"" eğitiminde sivriltilmiş mercan kayalarında sürünme, takla atma gibi birçok zorlu engelden geçiriliyor. İşte zorlu eğitimden kareler... CENNETE GİDEN YOL / FOTO GALERİ",0
305,"Çok hızlı yemek yemek, aşırı alkol ve sigara kullanmak hıçkırığa neden olabilir. Hıçkırık, [PET_BOUNDARY]göğüs[PET_BOUNDARY] boşluğu ile karın boşluğunu birbirinden ayıran ve diyafram adı verilen kasın istem dışı kasılmasını takiben ses tellerinin bulunduğu gırtlak bölgesinin aniden kapanmasıyla oluşur ve bu sırada bir 'hık' sesi duyulur. Dakikada 10 - 30 kez tekrarlayabilen bu kasılmalar diyaframdan başka kaburgalar arasındaki kaslarda da saptanabilir.",0
1019,"gelip baktılar bir şey yokmuş! Şimdi bu sıcaklarda da kullanamıyoruz. Geldi baktılar montajda delik boru takılmış, [PET_BOUNDARY]gaz kaçırıyormuş[PET_BOUNDARY] . Şimdi bayramd... 3 temmuzda tarafıma teslim. Edilen Airfel markalı klimanın montajını bir türlü yaptıramadım ne",0
892,". Ani kabızlığın yanı sıra karın ağrısı veya kramp hissi varsa, aynı zamanda hiçbir şekilde tuvalet yapılamıyor ve [PET_BOUNDARY]gaz çıkarılamıyorsa[PET_BOUNDARY] mutlaka ve acilen doktora başvurmak gereklidir. Eğer kabızlık yeni başladıysa ve alınan önlemler yeterli",1
889,"içinde yapılabilir ve hasta aynı gün normal besinini yiyebilir. Kolonoskopi sonrası gerginlik, şişkinlik hissi, [PET_BOUNDARY]gaz çıkarılması[PET_BOUNDARY] ile azalır. Sizi Arayalım Safra yolları iltihaplanmasında ilk önce muayene edilmesi gereken şey tıkanmaya sebep",1
130,"2 aydır ünlü oyuncu Kıvanç Tatlıtuğ'la [PET_BOUNDARY]birlikte olan[PET_BOUNDARY] stil danışmanı Başak Dizer Şamdan Plus'a verdiği röportajda özel hayatıyla ilgili ilk kez konuştu. Özel hayatıyla gündeme gelmek istemediğini belirten Dizer, ""Çok mutluyum ama o kadar"" dedi. Her zaman yaptığı işle anılmak istediğini söyleyen stil danışmanı Dizer, yaşadığı ilginin de alışık olmadığı bir durum olduğunu söyledi.",0
151,"Olay, Buca 921 Sokak'taki evde meydana geldi. Emekli A.İ., bir süredir [PET_BOUNDARY]birlikte olduğu[PET_BOUNDARY] Nermin Akçay ile henüz bilinmeyen bir nedenle tartışmaya başladı. Tartışmanın kavgaya dönmesi üzerine A.İ. iddiaya göre, Akçay'ı bıçaklayıp evden ayrıldı. Bugün sabah saatlerinde Karabağlar Polis Merkezi'ne giden A.İ. polise teslim oldu. Gözaltına alınan A.İ.'nin olayı anlatması üzerine eve giden polis, kadının cansız bedenini buldu. Olayla ilgili başlatılan soruşturma sürüyor.",0
1117,", sosyal haklarının tanınmasıyla ilgili sosyal devletin gereklilikleri gerçekleştirilmek durumundadır. Halkın [PET_BOUNDARY]canını teslim ettiği[PET_BOUNDARY] emekçilerin, kendi güvencelerinin olmaması kabul edilemezdir. Bu gerçeğe rağmen AK PARTİ iktidarı, sağlık",0
1205,"bir yerlerde ""yavaş ol"" diyen sesi hepimiz daha net duymaya başladık. Hafta sonları gidilen köy.... 35 yaşında beşeri [PET_BOUNDARY]hayatına veda eden[PET_BOUNDARY] Mozart bu yıl ölümsüzlüğünün 265. yılını kutluyor. Bu dünyadan göçerken, kötü hava koşulları sebebiyle cenazesin",0
254,"ABD Merkez Bankası’nın aldığı kararlar, piyasalarda deprem etkisi yaratırken, altın fiyatları da çakıldı. Altının ons fiyatı yüzde 2’den fazla düşerek 1.316 dolarla 2.5 yılın dibine geriledi. [PET_BOUNDARY]Gelişmekte olan ülke[PET_BOUNDARY] piyasalarında satışlar devam ederken, dolar içeride de 1.915 TL’yi geçti. Borsa İstanbul’da düşüş yüzde 3,6’ya ulaştı.",1
994,"okuyor. Shapiro'nun karşılaştırmalı okumaları devletlerin, devlet-olmayan güç odaklarının, silah ticareti, [PET_BOUNDARY]seks işçisi[PET_BOUNDARY] kaçakçılığı, kanun uygulama ve hüküm verme işleriyle uğraşan bireylerin eylemlerinden doğdukları haliyle savaş",1
831,baktım. Mesela Singapur'da bir sokak hayvanının Belediye yetkililerince sahiplendirilemediği durumlarda nasıl [PET_BOUNDARY]uyutulduklarına[PET_BOUNDARY]... Şahsım adına uyutulmaya karşıyım lakin kedi köpek gibi şehirlerde bizimle aynı hayatı paylaşan tüm evcil,1
837,"bir çalışma değildi. Evin badana edilmesi ve bazı yerlerinin onarılması gerekiyordu. Badanacı usta, iki günde [PET_BOUNDARY]işini bitirdi[PET_BOUNDARY]. Becerikli adam. Eşyaları odanın ortasına toplayıp üzerine naylon bir örtü koyup badanaya başlıyor. Yere ya da",0
706,". Ezikti işte. En önemlisi bu o kadar belli oluyordu ki ,bir kadın onu arzuladığı için değil onu ifal etmek için onunla [PET_BOUNDARY]birlikte olmuştu[PET_BOUNDARY] . Ertesi sabah uyandığında yataktan kalkmak bile istemiyor ,bilgisayarına gömülüp tüm günü odasında geçirmek",1
662,"nasip olmuştur. Bu borçlanmanın geri ödemelerinden dolayı zor durumda kalan maliye, devlette aylıkları önce [PET_BOUNDARY]aybaşı[PET_BOUNDARY] yerine ay ortalarında, sonraları da 3-4 ayda bir ödemek durumunda kalmıştır Nitekim sarayın bitirilmesine bir yıl",0
116,"İstanbul Asayiş Şube Müdürlüğü Ahlak ve Kumar Büro Amirliği ekiplerince Özbek asıllı Enver A. ile Muzaffer N, Recep S. ve Tekin K'nin elebaşı olduğu 2 ayrı fuhuş çetesiyle bağlantısı olduğu iddia edilen eski Antalya Yabancılar Şube Müdürü S.E. ile İstanbul Pasaport Şube Müdürlüğünde görevli polis memuru M.K. yakalandı. S.E'nin, Enver A'nın gönderdiği kadınlara kalacakları ev konusunda yardımcı olduğu, bunun karşılığında kadınlarla [PET_BOUNDARY]birlikte olduğu[PET_BOUNDARY] öne sürüldü.",1
775,"bir sınav mı yoksa deneyim mi olacak ? İkis... Kadınların Özel Günlerinde Bakım Yapmasının Hükmü Soru: Bayanların [PET_BOUNDARY]muayyen günlerinde[PET_BOUNDARY], saç tırnak kesimi, saç boyama vs... kişisel bakımlarını yapmaları sakıncalı mıdır? el Cevab: Saydığınız amellerin",1
283,"Mimar Sinan Mahallesi'nde bulunan Mimar Sinan İlkokulu'nda 2 el silah sesi duyuldu. Bunun üzerine içeri girenler, aynı okulda 21 yıldır memur olarak görev yapan Serap Fırat (41) ve hizmetli Ahmet Ateş'in (43) cesetleriyle karşılaştı. Yapılan ilk inceleme sonucunda, yanında av tüfeği bulunan Ahmet Ateş'in, Serap Fırat'ı öldürdükten sonra aynı silahla [PET_BOUNDARY]göğsüne[PET_BOUNDARY] ateş ederek yaşamına son verdiği belirlendi. Olay yeri inceleme ekipleri, Ateş'e ait araçta da inceleme yaptı.",0
244,"Fatih Mahallesi 825 Sokak'ta zihinsel [PET_BOUNDARY]engelli[PET_BOUNDARY] Mehmet H'nın evinden kötü kokular gelmesi üzerine mahalle sakinleri durumu belediyeye bildirdi. Üç gün önce temizlenen evin yeniden çöple doldurulduğunu tespit eden ekipler, Mehmet H. ile kendisi gibi zihinsel engelli olan annesi Hatice H'nın engellemesiyle karşılaştı. İlçe Emniyet Müdürlüğü ekiplerinin de ikna edemediği anne ve oğlu, biber gazı kullanılarak evden çıkarıldı. Belediyesi ekipleri, evden 7 kamyon dolusu çöp çıkardı.",1
797,"günlük akıntısı bazen çok yoğun oluyor, özre girecek kadar. Bu durum bitince gusledilmeli midir? 2-Kadınlar [PET_BOUNDARY]muayyen günlerinde[PET_BOUNDARY] saç boyatabilir mi? Dinen caiz midir? 3-Kadınlar namaz kılarken badinin üstünde hırka v.s bir şey olmalı mıdır? Bu",1
614,54738        Antalya'ya yerleşen Ali Suat Eser 26 Şubat 2018 pazartesi gününün ilk saatinde yaşama veda ederek [PET_BOUNDARY]aramızdan ayrıldı[PET_BOUNDARY].,1
380,"Samsundan bir hafta önce RoRo gemisiyle Rusyaya giden TIR şoförü Erdal Sarı (27), Novorossissk Limanında Rus [PET_BOUNDARY]hayat kadını[PET_BOUNDARY] için çıkan tartışmada bir Türk şoför tarafından bıçaklanarak öldürüldü. İddialara göre, hayat kadını için tartışan arkadaşlarını ayırmak isteyen Sarıyı, Ali Yıldırım (48) adlı bir şoför bıçakladı. Sarı olay yerinde ölürken, Yıldırım kayıplara karıştı.0",1
898,"arkasından konuşuruz ki? Allah'ın bize şaşmaz bir emri midir bu? - Üç kişi kendi aramızda sohbet ederken birimiz [PET_BOUNDARY]aramızdan ayrıldığında[PET_BOUNDARY], geri de kalan iki kişi neden hemen gideni atıp tutmaya, çekiştirmeye başlar ki? - Evden ayrılan aile bireyi yıllarca;",0
0,"Takvim'de yer alan habere göre Akkaya, kızı Ayşe'nin jimnastik dersinde çekilen fotoğrafını önceki gün İnstagram'da n takipçileriyle paylaştı. Minik kızın fotoğrafının altına yapılan çirkin bir yorum eski mankeni çileden çıkardı. ""Bu leş, [PET_BOUNDARY]akıl hastası[PET_BOUNDARY] pis sapık, çocuk fotoğrafları altına iğrenç yazılar yazmakta! Bu sapığı elbirliği ile şikâyet edelim ve anasından doğduğuna pişman edelim!"" diyen Akkaya, takipçisini mahkemeye vereceğini söyledi..",1
827,". 2 saat süren operasyonun ardından buzağıda dışkı yapacak yer açılamadığı için aile sahiplerinin onayı ile hayvan [PET_BOUNDARY]uyutuldu[PET_BOUNDARY]. Veteriner Önder Alkan, hayvanın bağırsakları ve iç organları gelişmediği için uyutmak zorunda kaldıklarını",1
696,keyifleri konusunda çok iddialıyım ve hiçbir müşterim ben zevk almadım diyip ayrılmadı benden ki zaten en az iki kere [PET_BOUNDARY]birlikte olmuşumdur[PET_BOUNDARY] her müşterimle. Bazıları sürekli müşterimdir ve sende onların arasında olabilirsin benimle tanıştıktan sonra.,1
908,tarihinde bizleri sonsuz acılara garkederek.aramızdan ebediyen ayrılan kıymetli eşim ve babamız ENVER İSEN'in [PET_BOUNDARY]son yolculuk[PET_BOUNDARY] törenine iştirak ederek çelenk göndermek lûtfunda bulu TEŞEKKÜR Çok kıymetli varlığımız BERGÜZAR ARGUN'un,1
973,"biliyorum, elbette onlara hak veriyorum ve kusursuzluğun ön planda olmasını bende seviyorum. Gerçek fotoğraflı [PET_BOUNDARY]hayat kadını[PET_BOUNDARY] ilanımda tüm detaylarımdan bahsetmek istedim ve elimden geldiğinde size kendimi tanıttım. Fakat birebir",1
658,kalmak yerine karşı çıkmayı istediğim için yazmadım bir süre sadece yorum yapmayı seçtim ve bu adamlar yüzünden [PET_BOUNDARY]aramızdan ayrılan[PET_BOUNDARY] veya bu siteye alakası azalan arkadaşların yavaş yavaş fazlalaşması da canımı sıkmadı değil) Ne diyorduk? Yazarken,0
71,"Haberin diğer fotoğrafları için tıklayın 2012 yılında kendisinden 9 yaş küçük iş adamı Wissam Al Mana ile evlenen Janet Jackson, şu an bebek [PET_BOUNDARY]bekliyor[PET_BOUNDARY]. 7 aylık hamile olan 50 yaşındaki Janet'ın hamilelikte bir hayli kilo alması dikkati çekti.",1
739,"hizmetlerle tanıştırdı. Leila* kürtaj yaptırmak için yardım kuruluşuyla temasa geçti, çünkü eşi onu öldürmek ve [PET_BOUNDARY]hamileliğini sonlandırmazsa[PET_BOUNDARY] karnına tekme atmakla tehdit etmişti. Geçmişte ona asla fiziksel olarak zarar vermemiş olsa da dehşete kapılmıştı ve",0
541,"Başarılı geçen ameliyat sonrası Sayan, bir gün hastanede kaldıktan sonra taburcu edildi. Ameliyata girmeden odasında [PET_BOUNDARY]uyutulmak[PET_BOUNDARY] istediğini söyleyen Sayan, videosunu Instagram ’dan paylaşıp ""Benim bir şeyim yok derken aniden tüm dünya dönmeye başladı. Şimdi izleyince epey bir güldüm. Çok şükür ameliyat çok iyi geçti"" diye not düştü.",0
196,"Monti, ABD'de katıldığı bir konferansta yaptığı konuşmada, [PET_BOUNDARY]ekonomik[PET_BOUNDARY] zorlukların AB'yi bazı yapısal sorunları ile yüzleştirdiğini ve bunların çözümüne zorladığını belirtti. İtalya Başbakanı, ""AB, krizleri yönetmek amacıyla kurulmadı. İnanıyorum ki bu makinede bir güncellemeye şahit olmaktayız"" diye konuştu. Birlikten ayrılan değil, ona dahil olan ülkeler gördüğünü belirten Monti, AB ve Avro Bölgesi'nin gelecek yıllarda büyüyeceğini öngördüğünü söyledi.",0
547,"Bülent Korkmaz'ın, bir süredir rahatsız olan annesi Nevin Korkmaz İstanbul'da yaşamını yitirdi. Acı haberi alan Bülent Korkmaz, Mersin'den İstanbul'a gitmek üzere yola çıktı. Mersin İdmanyurdu Basın Sözcüsü Ayhan Erdem de sosyal medya hesabından paylaştığı başsağlığı mesajında ""Kulübümüzün değerli hocası Bülent Korkmaz'ın annesi Nevin Hanımefendi [PET_BOUNDARY]vefat etmiştir[PET_BOUNDARY]. Değerli ailesine başsağlığı ve sabırlar dileriz"" ifadesini kullandı.",1
163,"RADİKAL  -  Tikhonova’nın 18 Şubat’ta Moskova’dan İstanbul’a geldiği ihbarı üzerine istihbarat birimleri harekete geçti. Patlayıcı uzmanı 18 yaşındaki kadının Dağıstan ’da bulunan arkadaşlarına, ""Türkiye’de kendimi patlatacağım. 2 haftaya kadar [PET_BOUNDARY]cennete gideceğim[PET_BOUNDARY]"" diyerek veda ettiği bilgisi de istihbarat raporlarına yansıdı. Tikhonova hakkında elde edilen bilgiler, 2 Mart’ta gizli yazıyla 81 kentteki birimlerle paylaşıldı. (Habertürk)",1
211,"Zihinsel [PET_BOUNDARY]engelli[PET_BOUNDARY] kızın annesi, olaya ilişkin yaptığı açıklamada; ""Şoför de kızımı alıyor üç hafta üst üste aynı yere götürüp tecavüz ediyor. Olay 30 Ocak'ta meydana gelmiş. Bizim yeni haberimiz oldu ve suç duyurusunda bulunduk. Doktor raporlarında her şey çıktı"" dedi.",1
870,"uzuv kesilir ki insan hayatı devam edebilsin, hatta beyin ölümü gerçekleşen bir insanın da birçok doktorun kararıyla [PET_BOUNDARY]fişi çekilir[PET_BOUNDARY]. İşte biz de Çan'da kuruyan ve artık görevini tamamlayan ağaçların yerine yenilerini dikiyoruz. Kimi ağaçları da",1
152,"McConaughey'in, bir internet sitesine, kendisi ve Alves'in fotoğrafını gönderdiği ve ""Camila'ya evlenme teklif ettiğim an, mutlu Noeller"" notunu eklediği belirtildi. Oyuncunun sözcüsü de bu fotoğrafı ve mesajı doğruladı ancak ayrıntılı bilgi vermedi. Uzun zamandır [PET_BOUNDARY]birlikte olan[PET_BOUNDARY] 42 yaşındaki McConaughey ile 28 yaşındaki Alves'in, biri 3 diğeri 2 yaşında iki çocukları bulunuyor.",0
554,"TBMM 13. dönem Çanakkale milletvekillerinden Muammer Baykan (91) [PET_BOUNDARY]vefat etti[PET_BOUNDARY]. 1954 - 1956 yılları arasında Basın Yayın ve Turizm Umum Müdürlüğü de yapan Baykan, tedavi gördüğü Bayındır Hastanesinde yaşamını yitirdi. Evli ve 2 çocuk babası Baykan, 13. dönem Çanakkale milletvekilli olarak parlamentoda görev yaptı. Baykan'ın naaşı, perşembe günü TBMM'de düzenlenecek törenin ardından Karşıyaka Camisi'nde ikindi vakti kılınacak cenaze namazını müteakip, Karşıya Mezarlığı'nda toprağa verilecek.",1
693,"olarak görülmektedir. İkinci neden olarak "";;sosyal yapı"";; yı söyleyebiliriz. Ergenlikte az kadınla/erkekle [PET_BOUNDARY]birlikte olmuş[PET_BOUNDARY] olmak, evlenmeden önce doyuma ulaşmamış olmak, görücü usulü evlilik yapmış olmak, erken yaşta evlenmek ya da tutucu",1
393,"Bursa'nın Osmangazi ilçesinin Tuna Mahallesi'nde ikamet eden H.K ile damadı R.V evlerinin terasına kanepe çıkarmak isterken facia yaşandı. Terasa bir mekanizma ile çıkarmak istenilen kanepe, halatların yeterince sağlam olmaması sebebiyle koptu. Aşağıda bekleyen damat R.V halatın koptuğunu görmeyince hızla aşağı düşen kanepenin altında kaldı. 112 Acil servisle ilk müdahalesi yapılan R.V, hastaneye kaldırılırken hayatını [PET_BOUNDARY]kaybetti[PET_BOUNDARY]. Olayla ilgili detaylı araştırmalar devam ediyor.",1
384,"Geçtiğimiz günlerde İstanbul Gayrettepe'de açılışı yapılan Anatomica Kulak Burun Boğaz Hastanesi, Türkiye’de bir ilki gerçekleştirerek maddi imkanı olmayan [PET_BOUNDARY]işitme engelli[PET_BOUNDARY] çocuklara ücretsiz sağlık hizmeti vermeye başladı. Hastanede, İstanbul’da yaşayan ve maddi durumu yerinde olmayan 0 - 18 yaş arasındaki çocukların herhangi bir belge göstermeden, muayenelerinden ameliyalarına kadar her türlü tedavileri ücretsiz olarak gerçekleştirilebilecek.",1
1126,". Trafik kazası dediysek öyle aşırı hız yapan arabasıyla takla makla atmamış. Caddede halk otobüsü çarpmış, oracıkta [PET_BOUNDARY]canını teslim etmiş[PET_BOUNDARY] kadıncağız. Bildiğin fukara işi bir trafik kazası ve fakir bir ölüm. İşine ve ustasına çok bağlı. Şevkle yapıyor",1
48,"""Tören, bütün  evreleriyle kırmızı kan ile ilgilidir: [PET_BOUNDARY]Aybaşı[PET_BOUNDARY] kanamasının rahimden gelen kanı,  hep ayaklara doğru akan kanlardır; ve özgün kırmızı ayakkabılarda pek çok  mânâ gizlidir.""",1
589,"114461        Bebek [PET_BOUNDARY]bekleyen[PET_BOUNDARY] kadınların hastane çantalarına koydukları malzemeler, yaşadıkları ülkenin sosyo-ekonomik seviyesine, misal, hastanelerde temiz su olup olmadığı gibi kritik noktalar hakkında da ipucu veriyor.",1
641,"779480        Şartlar gereği [PET_BOUNDARY]aramızdan ayrılacak[PET_BOUNDARY] olan Öğretmenenimiz Eren KURT´a verdiği hizmetlerden ötürü teşekkürlerimi sunar gideceği yerde başarılarının devamını dilerim.""",0
357,"""Kitabın üçüncü  baskısı, yazarının [PET_BOUNDARY]hakka yürümesinden[PET_BOUNDARY] (06.01.1995) sonra, 1997 yılında  yapılmıştır.""",1
557,"Sivas'ta yaklaşık 1.5 yıldır görev yapan Vali Kemelek'e, bir süre önce karaciğer nakli yapıldı. Turgut Özal Tıp Merkezi'nde tedavisi devam eden ve bir türlü sağlığına kavuşamayan 60 yaşındaki Zübeyir Kemelek'in durumu birkaç gün önce kötüleşti. Evli ve 3 çocuk babası olan Vali Kemelek'in, doktorların tüm çabasına karşın bu sabah [PET_BOUNDARY]vefat ettiği[PET_BOUNDARY] açıklandı. Vali Zübeyir Kemelek'in ölümü, görev yaptığı Sivas'ta büyük üzüntü yarattı",1
1034,Boyacıköy Hekim Ata Caddesi'ndeki bir apartman dairesinde banyo yapan Emin Okumuş 20)tüpgazla çalışan şofbenin [PET_BOUNDARY]gaz kaçırması[PET_BOUNDARY] sonucu zehirlenerek öldü. Bankayı dolandırdı Or İLAN ÇAY İŞLETMELERİ GENEL MÜDÜRLÜĞÜ İSTANBUL ÇAY PAKETLEME,0
494,"Trafik kazasında iki ayağını kaybeden ""Uncle Willie"" yi [PET_BOUNDARY]uyutmak[PET_BOUNDARY] zorunda kalan Hemingway, 1950 tarihli bir mektubunda bir arkadaşına ""Bir insanı öldürmek zorunda kalabilirdim ama asla sevdiğim ve 11 yıldır tanıdığım bir canlıyı değil"" sözleriyle üzüntüsünü tarif ediyor. Kedisini uyuttuğu gün Küba’daki evini ziyarete gelen turistlerden de mektubunda bahseden yazar ""Onlara kötü bir zamanda geldiklerini söyleyerek anlayış göstermelerini rica ettim"" diyor.",1
576,"Oyuncu Tamer Karadağlı'nın babası bu Sabah [PET_BOUNDARY]vefat etti[PET_BOUNDARY]. Yapımcı birol güven, acı haberi sosyal medyadan duyurdu. Güven, ""Değerli sanatçımız Tamer Karadağlı'nın babasını bu sabah kaybettik. Cenazesi Ankara'da n kaldırılacak. Bilgileri paylaşacağım."" diye paylaşım yaptı. 100.000  Sanal Para ve Eğitim Rehberi ile Forex’i Ücretsiz Öğrenin! 2016 Yılı 4.Çeyrek Kâr / Zarar Oranı: %18  /  %82 Etiketler: Tamer Karadağlı , baba , vefat , Sabah , Ankara , birol güven , Tamer Karadağlı",1
750,". Güç tasarrufu modunu etkinleştirmek için lütfen Erişilebilirlik hizmetlerine izin verin. Hizmet, yalnızca [PET_BOUNDARY]engelli[PET_BOUNDARY] kullanıcıları uygulamaları açmak için hatırlatmak ve pil kullanımını azaltmak için kullanılır. AppLock'un, özel verilerinize",1
998,"gibi, eğlenceli bir gece arıyorsanız, bir fahişe ile eskort tutmak arasında çok büyük bir fark var. Her ikisinin de [PET_BOUNDARY]seks işçisi[PET_BOUNDARY] olması aynı şey oldukları anlamına gelmez. Ama var olan tek fiziksel temas seks işçisi olmadıklarını biliyor",1
1180,"ile yeniden hayata döndü ve yoğun bakıma alındı. 3 saat yoğun bakımda kaldıktan sonra ise, doğum gününe 15 gün kala [PET_BOUNDARY]hayatına veda etti[PET_BOUNDARY]. Arkadaşları, Ercan'ın yaşam dolu ve çok çılgın olduğunu söyledi. Aynı zamanda hastalığından bahsetmekten de hiç",1
1249,"nde General Motors ve Toyota'nın ardından üçüncü sırada yer alıyor Ocak 2008'de Ford, 13.000 çalışanı daha işten [PET_BOUNDARY]çıkarmak[PET_BOUNDARY] için yeni bir kıdem tazminatı programı duyurdu. 2009 yılında kötü geçen bir mali yılın ardından, grubun yeniden",1
