,text,label
155,"AVUKATLARA KESİN TALİMAT VERDİ Seki'yi ziyaret etmek isteyen eski sevgilinin futbolcu Ali Turan olduğu öğrenildi. Eski sevgilisi Ali Turan'ın görüşme isteği üzerine çok sinirlendiği söylenen Seki'nin, avukatına kesin talimat verdiği iddia ediliyor. Şarkıcı, iki yıl önce ayrıldığı Turan'ın ardından şimdiki nişanlısı Faruk Salman'la [PET_BOUNDARY]birlikte olmaya[PET_BOUNDARY] başlamıştı.",0
616,"70583        Atamızın [PET_BOUNDARY]aramızdan ayrılışının[PET_BOUNDARY] yıldönümünde, kendisini saygı, özlem ve minnetle anıyorum.",1
561,"Bir süredir sağlık sorunları yaşayan Yahudi Cemaati eski Başkanı Sami Herman [PET_BOUNDARY]vefat etti[PET_BOUNDARY]. 1950’de İstanbul’da doğan, İlkokulu Şişli Terakki'de, ortaokulu Saint - Michel'de, liseyi Saint - Benoit'da okuyan Herman, yüksek tahsilini Sultanahmet İktisadi ve Ticari İlimler Akademisi'nde yaptı. Yahudi cemaatinin birçok alanında gönüllü olarak görev alan Herman, başkanlık görevini 2013 yılında İshak İbrahimzadeh’e devretmişti. Herman, Fransızca, İngilizce ve İspanyolca biliyordu.",1
202,"Arnavutluk Başbakanı Sali Berişa yayımladığı yeni yıl mesajında, 2008'de NATO'ya üyelik davetini sağladıklarını, böylece ülkenin ""kendi ailesine geri döndüğünü"" kaydetti. Berişa, 2008'de [PET_BOUNDARY]ekonomik[PET_BOUNDARY] reformları da başarıyla uyguladıklarını belirtti. Başbakan Berişa, ""2008'de sağladığımız başarılarla 2009 yılının bizim için büyük bir yıl olacağını ümit ediyorum. 2009'da Arnavutluk'un NATO'ya üyeliğinin gerçekleşeceğini, AB üyeliğine aday statüsü kazanacağımızı umuyorum"" dedi.",0
268,"Maslak Acıbadem Hastanesi’ndeki ameliyatın ardından bir hafta tedavisine devam edilen modacıya çıkışta menajer Stelyo Pipis eşlik etti. Basın mensuplarının ilgi gösterdiği Yerlitaş, ""Herkese çok teşekkür ediyorum. Her kadının [PET_BOUNDARY]göğüs[PET_BOUNDARY] kontrollerini yaptırmasını istiyorum"" dedi. Yüzlerce geçmiş olsun mesajı alan Yerlitaş’ın, sosyal medya hesabından ""Kır dümeni kaptan, aydınlık sabahlara... Güzel insanlara, mutlu yarınlara"" diye yazması dikkat çekti.",1
316,"Olay öğlen saatlerinde Irak sınırına sıfır noktada bulunan Şemdinli İlçesi Derecik Beldesi Yeşilova Jandarma Karakolu'nda meydana geldi. Kayseri'deki Kocasinan İlçesi nüfusuna kayıtlı Harun Aslan, henüz bilinmeyen bir nedenle [PET_BOUNDARY]göğsüne[PET_BOUNDARY] bir el ateş etti. Ağır yaralı olarak kanlar içinde yere yığılan Aslan, ilk müdahale ardından helikopterle Hakkari Asker Hastanesi'ne kaldırıldı. Burada yapılan tüm müdahalelere rağmen Aslan kurtarılamadı.",0
50,"""Ay'ın evreleri ile cinayetler, kazalar , dünyamızda oluşan kasırgaların dağılımı, magnetik alanlarda bozulma, kadınların [PET_BOUNDARY]aybaşları[PET_BOUNDARY]  ve sara nöbetleri arasındaki ilişkileri yakından takip ediyorlar, devamlı istatistiki bilgi  topluyorlar.""",1
669,ise gebe kalma ihtimalinin tedricen yüzde yüze kadar yükseldiği günleri göstermektedir. Çocuk yapmamak isteyenler [PET_BOUNDARY]aybaşı[PET_BOUNDARY] oldukları günün karşısında görülen iki tarih arasında cinsi temasta bulunmamalıdırlar. Bunun için yatak,1
1165,\ İngiltere Çiftçi bir ailenin çocuğu olan Newton Noel zamanında dünyaya gelir. Babası Newton doğmadan 3 ay önce [PET_BOUNDARY]hayata veda eder[PET_BOUNDARY]. Newton ilk doğduğunda çevresindekilerin hiçbiri yaşayacağına inanmıyordu çünkü çok zayıf ve çelimsiz bir şekilde,1
631,616315	Mandalı kendisinin ve yeğeninin de kansere yakalandığını ifade ederek “Yeğenim lise öğrencisi iken kan kanserine yakalandı ve [PET_BOUNDARY]aramızdan ayrıldı[PET_BOUNDARY].,1
1022,? Bizde bu durumdan muzdarip mesleğe yeni başlamış klimacı kardeşlerimiz için detaylı anlatım yaptık. Eğer klima [PET_BOUNDARY]gaz kaçırmış[PET_BOUNDARY] işe öncelikle gaz kaçağı tespit edilip kaçak giderilmeli. Sonrasında ise klimanın havşa bağlantıları yeni rekor,0
341,Âcil hastanın  durumu vahamet kazanır ve sonunda da [PET_BOUNDARY]hakkın rahmetine kavuşur[PET_BOUNDARY].,1
428,"Altın fiyatları bugün açıklanacak tarım dışı istihdam verilerinin öncesinde dolardaki yükselişle beraber altı haftanın en büyük haftalık [PET_BOUNDARY]kaybını[PET_BOUNDARY] yaşamaya hazırlanıyor. Spot altının ons fiyatı yatay bir seyirle 1,278.70 dolardan işlem görürken, haftalık bazda yüzde 1.2 kayıp gerçekleştirmeye hazırlanıyor. ÇEYREK ALTIN NE KADAR? Kapalıçarşı'da altının gramı 120,60, çeyrek altın 198,56 liradan işlem görüyor.",0
1211,"ve bu onun en fazla 3 yıl daha fazla yaşamasına sebep olmuştur. 1993 yılı kasım ayında pnömoni(zatürre)den dolayı [PET_BOUNDARY]hayatına veda etmiştir[PET_BOUNDARY]. Tenis dünyasının büyük kaybı olan Ashe, başkan Dinkins'inde söylediği gibi, ""Başkalarına hizmet, yeryüzündeki",1
932,"düşünür giydiklerimi kirletmemeye özen gösterirdim. İşte annemin bu titizliği hiç göremediğim (doğduğumda [PET_BOUNDARY]hakka yürümüştü[PET_BOUNDARY]) Rahmetli Babannem'den almış olduğunu, babaannemin Arnavutluk'tan göçerken Anavatan'a gelişlerindeki göç",1
488,"""Sağlık Bakanlığı yetkilileri, söz konusu sivil  toplum örgütlerinin bu kişilere ulaşılmasında son derece etkili olduğunu belirterek, yapılan  iş birliği sayesinde bugüne kadar bin 414 [PET_BOUNDARY]seks işçisi[PET_BOUNDARY], bin 57  eşcinsel, 29 damar içi madde kullanıcısı ve 461 hükümlüye ulaşıldığını,  13 bin dolayında broşür ve kitap gibi yayın ile 34 bin 656  kondom dağıtıldığını ve 63 HIV / AIDS'le yaşayan kişiye destek verildiğini bildirdiler .""",1
183,"Dünyanın en büyük cep telefonu üreticisi Nokia, küresel [PET_BOUNDARY]ekonomik[PET_BOUNDARY] krizin cep telefonu endüstrisini olumsuz etkilemesi nedeniyle maliyetleri düşürmek için Finlandiya'nın güneyindeki Jyvaskyla'daki araştırma ve geliştirme fabrikasını kapatacağını ve bu kararın fabrikada çalışan 320 kişiyi etkileyeceğini açıkladı. Nokia, daha önce Finlandiya'nın güneyindeki Salo'da bir fabrikada 2,500 kişinin işine son vereceğini bildirmişti.",0
694,eskortluk yapmaktayım. Kepez Eskort olarak bu özelliklerde hizmet veriyorum. Toplasan en fazla 50 kişiyle falan [PET_BOUNDARY]birlikte olmuşumdur[PET_BOUNDARY] . Yaşımdan dolayı kaba konuşan erkeklerden tiksiniyorum ve onlarla birlikte olmaktan korkuyorum. Sadece Otele,1
239,"İzev (İstanbul Zihinsel [PET_BOUNDARY]Engelliler[PET_BOUNDARY] İçin Eğitim ve Dayanışma Vakfı) tarafından hazırlanan ve zihinsel engelli bireylerin sesini sanat yoluyla duyurmayı hedefleyen projede resim sanatına damga vuran ressamlarının 12 klasik eserleri, down sendromlu gençlerin fotoğraflarıyla birleştirilerek yeniden yorumlanıyor. Koleksiyon birçok ilde havaalanları, sanat evleri, galeriler ve müzelerde sergilenecek. Etiketler:",1
131,"Instagram’ın en çok takip edilen ünlü ismi Selena Gomez yeni bir rekora daha imza attı. Ünlü şarkıcının 2 hafta önce paylaştığı fotoğraf 4 milyonun üzerinde beğeni alarak rekor kırdı. Bir önceki rekor Justin Bieber’ın yine Gomez ile [PET_BOUNDARY]birlikte olduğu[PET_BOUNDARY] bir fotoğrafa aitti. Selena Gomez, 89 milyon takipçisiyle fotoğraf paylaşım uygulamasının en çok takip edilen ismi olmuştu. Kaynak: ( buseterim.com )",0
781,"me'zun olur ve Anadolu'da vazife alacaksa, Anadolu kazaskerinin; Rumeli'de vazîfe alacaksa Rumeli kazaskerinin [PET_BOUNDARY]muayyen günlerdeki[PET_BOUNDARY] meclislerine devam ederek, matlab denilen deftere (rûznâmeye) mülâzim kaydedilir. Sırası geldiğinde en aşağı",0
789,"gelen hafta kabul edilmiştir. Ticârî ve idârî bakımdan da haftanın belirli günlerinde belirli işlerin yapılması, [PET_BOUNDARY]muayyen günlerde[PET_BOUNDARY] muayyen saatlerde çalışmanın tâtil edilmesi ve ibâdet yapılması bütün dünyâda içtimâî hayâtın bir parçasıdır.",0
899,düşünüyorum. Yolculuk İçin Teşekkürler'in İtalyanca İngilizce ve Fransızcasını yazmanın da üstesinden geldi; [PET_BOUNDARY]aramızdan ayrıldığında[PET_BOUNDARY] Almanca metni yazmaya başlamıştı. Türkçesi bir Türkçe metni tamamlamasına elvermeyecek kadar paslanmış,0
722,"ilk 13 haftasında uygulanamaz. Çünkü kemoterapi fetüs üzerinde toksik etki oluşturur ve düşüğe neden olabilirken, [PET_BOUNDARY]hamileliğin sonlandırılması[PET_BOUNDARY] gerekebilir. Hamileliğin 14. haftasından sonra kemoterapinin cenin üzerindeki anomalilere yol açma riski düşük",1
453,"Akşam saatlerinde Milli Müdafaa Caddesi'nden Vekaletler Caddesi'ne dönüş yapan 06 HBJ 71 plakalı otomobil ile Güvenpark'taki minibüs duraklarına giden 06 J 0844 plakalı minibüs çarpıştı. Otomobilin sürücüsünün direksiyon hakimiyetini [PET_BOUNDARY]kaybetmesi[PET_BOUNDARY] üzerine, araç yoldan geçen 06 TUZ 95 plakalı başka bir otomobile çarptı. Kazaya karışan minibüs ise yolun kenarındaki ağaca çarparak durabildi. Kazada yaralanan 11 kişinin çeşitli hastanelere kaldırıldığı öğrenildi.",0
153,"""People"" dergisine açıklama yapan çift, harika geçen evlilik törenlerinde aileleri ve arkadaşlarıyla bir arada bulunmanın özel olduğunu belirtti. Birkaç yıldır [PET_BOUNDARY]birlikte olan[PET_BOUNDARY] çiftin, İtalya'nın güneyinde dünya evine girdikleri belirtildi. 31 yaşındaki Justin Timberlake ve 30 yaşındaki Jessica Biel, geçen aralık ayında nişanlanmıştı. (CNN Türk)",0
5,"Onur Aydın’ın ‘Yağmur - Kıyamet Çiçeği’ kitabından aynı isimle beyazperdeye aktarılan ve amansız hastalığı nedeniyle 33 yaşındayken [PET_BOUNDARY]aramızdan ayrılan[PET_BOUNDARY], Kazım Koyuncu’nun hayatının bir bölümünün anlatıldığı ‘Yağmur - Kıyamet Çiçeği’ filmi sanatçının 43’üncü doğum günü olan 7 Kasım’da vizyona girecek. Filmin oyuncu kadrosunda Engin Hepileri, Altan Erkekli, Devrim Saltoğlu, ve Sevtap Erkan Köstengil yer alıyor.",1
336,Heralde artık kalbim dayanmayacak ve dizinin sonunu  göremeden [PET_BOUNDARY]hakkın rahmetine kavuşacam[PET_BOUNDARY].,1
43,"""Yukarıdaki süreler,  ihya edilen süreye ilişkin tutar dahil her türlü borçların ödendiği tarihi takip  eden [PET_BOUNDARY]aybaşı[PET_BOUNDARY] itibarıyla bu Kanuna göre aylık bağlanmasında dikkate alınır.""",0
1206,",nikâh şekerlerini göndermeyi unutunca davetliler şeker beklediler Müşfik Kenter dün iki buçuk yıllık bekârlık [PET_BOUNDARY]hayatına veda edip[PET_BOUNDARY] ikinci defa dünya evine girdi. Jty-Esi AVRAM BİÇER VE ORTAKLARI Genel İthalât Koli. Şti. Her nev'î Şekerleme",0
1245,"alınan izinler, saklanır, arşivlenir, belgelerin güvenliği ve gizliliği sağlanır, gerektiğinde arşivden [PET_BOUNDARY]çıkarılır[PET_BOUNDARY] ve tüm bu süreç taraflarca kolaylıkla yönetilir. İYS'ye Başvurabilmek İçin e-İmza Gerekli midir? Başvuru",0
1062,"güç sıralamaları değişmeli diyordum vazgeçtim. Kusursuz ayarlanmış. 2.nin ölmesi dışında pek bir şey olmadı, zaten [PET_BOUNDARY]gidiciydi[PET_BOUNDARY] o. Yeni bölümü merakla bekliyorum. Güzel bir bölümdü. Koskoca Hueco Mundo kralı'nı Hacchigen tek başına yenmiş oldu.",1
90,"Çek Cumhuriyeti'nin kuzeyinde seçmenlerle görüşen Miloş Zeman, ""Türkiye, AB'ye üye yapılmamalı"" dedi. AB'nin Türkiye'ye 3 milyar euro yardım yapmasını eleştiren Zeman, ""Türkiye, bu sığınmacılara bakacak güçte, çünkü bu insanlar onlarla aynı dinden"" dedi. Türkiye'yle ilişkilerin dikkatli bir şekilde inşa edilmesi gerektiğini savunan Çek Cumhuriyeti Devlet Başkanı, ""Bu ifadelerimden dolayı Türk Büyükelçisi'nin Prag Kalesi'ne protesto notu göndermesini [PET_BOUNDARY]bekliyorum[PET_BOUNDARY]"" dedi.",0
581,"Konuyla ilgili sarı lacivertli kulübün internet sitesinden şu açıklama yapıldı: Futbol takımımızın oyuncusu Pierre Webo'nun annesi Mague Jacqueline'nin (57), gece yarısı [PET_BOUNDARY]vefat ettiği[PET_BOUNDARY] haberini üzüntüyle öğrendik. Bir süredir tedavi gören Mague Jacqueline'nin vefatından dolayı başta oyuncumuz Pierre Webo olmak üzere tüm ailesinin acısını paylaşır, taziye dileklerimizi iletiriz.",1
465,"Halk Plajı'nda serinlemek amacıyla denize giren Halis Balıkçı (73), bir süre sonra çırpınmaya başladı. Suda [PET_BOUNDARY]kaybolan[PET_BOUNDARY] yaşlı adam, Karasu Belediyesi cankurtaran ekiplerince kıyıya çıkarıldı. Sağlık ekiplerinin ilk müdahalesinin ardından Karasu Devlet Hastanesi'ne kaldırılan Balıkçı, buradaki müdahalelere rağmen hayatını kaybetti. 4 çocuk babası olduğu öğrenilen Balıkçı'nın cesedi otopsi için İstanbul Adli Tıp Kurumu'na gönderildi.",0
459,"Rusya Parlamentosu Alt Meclisi Duma'da kabul edilen yasaya göre, Rus internet sitelerinde alkol reklamı yayınlanması yasaklanacak. Basın ve reklam şirketleri arasındaki anlaşmalar yıllık yapıldığı için, yasanın 1 Ocak 2013 tarihinde yürürlüğe girmesi planlanıyor. Yasaya karşı çıkan gruplar, alkol reklamlarının yabancı internet sitelerine kayacağını ve gelir [PET_BOUNDARY]kaybına[PET_BOUNDARY] yol açacağını savunuyor.",0
1082,", günahlarından arındırıyor ve hangi cenahtan olurlarsa olsunlar, mezhep cengâverlerini, bu dünyadan [PET_BOUNDARY]öteki dünyaya göç etmeleriyle[PET_BOUNDARY] beraber, ekspres vasıtayla, cennete taşıyor... Böylesi kafalar, bir de Atatürk Cumhuriyeti'nde, düpedüz,""mezhep",1
1153,". Alanında uzman bir firma olarak, sektörün aranan markalarından biri olarak çalışmalarımızı sürdürüyoruz. [PET_BOUNDARY]Ekonomik[PET_BOUNDARY] matbaa konusunda hemen hemen her firmanın ve kurumun ihtiyacı bulunmaktadır. Hacim ya da sektörel ihtiyaç fark",1
1216,"yaptığı G20 Zirvesi, merkezine kalkınma konusunu yerleştirmiş durumda[2]. Öncelikli odağın gelişmekte olan ve [PET_BOUNDARY]düşük gelirli[PET_BOUNDARY] ülkelerin, somut ve büyüme odaklı eylemler ile dünya ekonomisine entegrasyonu olduğu ifade ediliyor. Gelişen",0
940,"sınırlarını genişleterek Musul ve Bağdat gibi merkezi yerleri de Safevi devleti sınırları içine aldı. Şah İsmail'in [PET_BOUNDARY]Hakka yürümesinden[PET_BOUNDARY] (1524) sonra yerine oğlu 1. Tahmasp geçti. Tahmasp, Safevi devlet örgütlenmesini güçlendirmeye çalışırken babası",1
1130,"katkı maddesi içermez. Maybi'nin buluşu olan Milkylac, süt tozunu sadece aroma ve tat için kullanan müşterilerimize [PET_BOUNDARY]ekonomik[PET_BOUNDARY] alternatif olarak sunduğumuz peynir altı suyundan üretilen özel bir ürünümüzdür. Trakya'nın pastörize edilmiş",1
1104,"Nuriyi buradan alıp evine götürdüklerinde ""La ilahe illallah"" demesi telkin edildi. ""Zaten Ona gidiyoruz ya"", deyip [PET_BOUNDARY]canını teslim etti[PET_BOUNDARY]. *** Allah'ın selamı üzerlerine olsun Allah göğsünüzü, içinizi ısıtsın sımsıcak yapsın inşaallah kardeşlerim ***",1
770,"sallayıp,hareme serbestçe girmek gibi yetkileri yoktu... Haremi idare eden valide sultanlardan izin alınıp; [PET_BOUNDARY]muayyen gün[PET_BOUNDARY] veya saatler içinde görüşmeler gerçekleşirdi... Saray; sadece padişah ve ailelerinin yaşadığı alelade bir mekan",0
1069,Çok yaşlı bir palamutu karınca sarmış. Ağaç delik deşik vaziyette. Yanında hayvan otlatan köylüyle konuştum ona göre [PET_BOUNDARY]gidiciymiş[PET_BOUNDARY] ağaç. Ancak o kadar heybetli ve sağlıklı haldeki bu koca palamutun içindeki karınca yuvaları sebebiyle,1
619,100096        Barış MANÇO 2 ocak 1943´te İstanbul Üsküdarda doğmuş ve 1 şubat 1999´da [PET_BOUNDARY]aramızdan ayrılmıştır[PET_BOUNDARY].,1
89,"Bağış, Genel Kurul'a gelişinde gazetecilerin, konuşup konuşmayacağı yönündeki sorusuna, ""Duruma göre bakarız"" yanıtını verdi. ""Yani konuşma ihtimali var mı?"" sorusu üzerine Bağış, ""Siyasetçinin her zaman a planı, b planı, c planı olur değil mi"" dedi. ""Nasıl bir sonuç [PET_BOUNDARY]bekliyorsunuz[PET_BOUNDARY]?"" sorusuna ise Bağış, ""Hayırlısı olsun takdir yüce Meclis'indir"" karşılığını verdi.",0
1233,"Karar"" ile takım tezgahları başta olmak üzere birçok makine için Gümrük Vergisi'nin yatırım teşviki kapsamından [PET_BOUNDARY]çıkarıldığı[PET_BOUNDARY] açıklandı. Takım Tezgahları Sanayici ve İş İnsanları Derneği (TİAD),kararın yeniden gözden geçirilmesi için T.C.",0
1031,"yangın tüpüyle müdahale etti. Ancak müdahale yetersiz kalınca, itfaiyeye haber verildi. Olay yerine gelen ekipler, [PET_BOUNDARY]gaz kaçırdığı[PET_BOUNDARY] saptanan aracın LPG sistemi devre dışı bıraktı, küçük çaplı yangına müdahale ederek söndürdü. evet bu işlemleri 6 gün",0
27,[PET_BOUNDARY]Aybaşından[PET_BOUNDARY] aybaşına bir şişe rakı alıyorum.,0
1150,"ihtiyacı fark ederek ahşap palet ve ahşap ambalaj sandığı üretimine başlamıştır. Karton gövdeli sandık ürünümüz hem [PET_BOUNDARY]ekonomik[PET_BOUNDARY], hem de hafif olması nedeniyle tercih edilen bir üründür. Standart dışı ölçüler ve ağır yükler için kullanılan",1
946,"Hukuk Fakültesinde Öğretim Üyesi Prof. Dr.) ve Ömer Eyüboğlu gibi isimler geliyor. Hayatta olanlara sağlık dilerim, [PET_BOUNDARY]hakka yürüyen[PET_BOUNDARY] arkadaşlarıma ise rahmetler olsun. Cağaloğlu Şerefefendi Sokak Güneş Matbaacılıktaki gazeteme gelerek haberini",1
516,"Maç öncesi taraftarların kendilerini ""Welcome to Hell (Cehenneme hoş geldiniz)"" pankartıyla karşılamasını unutamadığını ifade eden Giggs şunları söyledi: ""Orada geçirdiğimiz 48 saat dün gibi aklımda. O gün, taraftarlar, takım otobüsüne çeşitli maddeler fırlatmıştı. Bizi [PET_BOUNDARY]uyutmamak[PET_BOUNDARY] için otelin önünde gece boyunca tezahürat yapmış ve odadaki telefonları arayıp durmuşlardı.""",0
354,"""Safevi devleti Alevi inancının  resmi olarak tanındığı, gelişmesinin desteklendiği, hatta örgütlendirildiği bir devlettir,  önemi de buradadır Şah İsmail’in [PET_BOUNDARY]Hakka yürümesinden[PET_BOUNDARY] (1504) sonra yerine  oğlu 1.Tahmasp geçti.""",1
351,"Türk sinemasının efsane oyuncusu Münir Özkul'un sosyal medyada öldüğü haberlerinin sürekli ortaya çıkmaya başlaması, kızı Güner Özkul'u n sert tepkisine neden oldu. ZUHAL TOPAL CANLI YAYINDA 'ÖLDÜ' DEDİ, KIZI TEPKİ GÖSTERDİ Son olarak evlendirme programı sunan Zuhal Topal, ""Programın başında söylemeyi unuttum. Özür diliyorum. Biliyorsunuz Sevgili Münir Özkul'u da kaybettik. [PET_BOUNDARY]Hakkın rahmetine kavuştu[PET_BOUNDARY]. Allah rahmet eylesin. Gani gani rahmet eylesin. Nurlar içerisinde yatsın inşallah."" dedi.",1
34,"""Vergi Barışı Kanunu'ndan yararlanmak isteyenlerin [PET_BOUNDARY]aybaşında[PET_BOUNDARY] başlayan başvuru ve vergi borcunun  ilk taksidini yatırma süresi, 31 Mart Pazartesi günü mesai saati bitiminde  sona erecek.""",0
960,"... Malatya'nın sevilen isimlerinden birisi olan; Hasan Altın yakalandığı amansız hastalıktan kurtulamayarak [PET_BOUNDARY]hakka yürüdü[PET_BOUNDARY]. - Haberi Hasan Altın hakka yürüdü... Malatya'da yıllarca Köy Hizmetleri, İl Özel İdare Başkanlığı ve Malatya",1
1250,". Yaptığı ya da yapmayı umduğu anlaşmaları kaybetmeyi göz önüne alamıyor. Zararı üstlenmek ve çalışanlarını işten [PET_BOUNDARY]çıkarmak[PET_BOUNDARY] zorunda kalıyor. Airbus firmasının bu durumu, iktisat yazınında tekelci gücünden yararlanamayan tekel kavramını",1
880,"iyi oldu :)) anlamamış olma ihtimali yüksek Bu gece uyanmaları nereye kadar ??2 saatte bir uyan emzir alt değiştir [PET_BOUNDARY]gaz çıkart[PET_BOUNDARY] emzir pışpışla , ben ne zaman istediğimi yapacağım, benim hayatım ne oldu, ölüyorum bitiyorum depresyondayım vıdı",1
513,"ABD'deki Pennsylvania Üniversitesi'nin araştırmasında, 39 kişinin kalp fonksiyonları, 10 saatlik bir gece uykusunun ardından ölçüldü. Sonraki 5 gece boyunca da denekler, 4'er saat [PET_BOUNDARY]uyutuldu[PET_BOUNDARY] ve de teste tabi tutuldu. 5 gece yetersiz uyumanın, deneklerin kalp atışının hızlanmasına yol açtığı, vücudun stres ve uyarıcılara tepki verme yeteneğini körelttiği belirlendi.",0
1163,"gelen 45 yaşında ve saygın bir işadamı olan oğlu salonda oturuyorlardı. Hal hatırdan,... 19 Ocak 2013 Cumartesi [PET_BOUNDARY]Hayata veda etmiş[PET_BOUNDARY] bir din adamın mezar taşının üstünde yazılı olan bir yazı: ""Genç ve özgür iken, düşlerim sonsuzken, dünyayı değiştir",1
1154,"Metin Group tecrübeli personeliyle her zaman hizmetinizdedir. Komple taşıma işlemlerinde de güvenli, hızlı ve [PET_BOUNDARY]ekonomik[PET_BOUNDARY] taşımacılık ilkelerini en ön planda tutmaktadır. Firmamız bu konuda çeşitli yatırımlar yaparak gerekli alt yapı",1
1212,"insanlar bu hâlleriyle intihar etmeye başladı. En az 60 kişi intihar etti, binlerce kişi kanser oldu, kalp kriziyle [PET_BOUNDARY]hayatına veda etti[PET_BOUNDARY]. Bunların çoğu yetişkin insanlardı ama OHAL döneminin zulümleri sadece yetişkinleri bulmadı, çocukları da buldu",1
383,"Dursun büyük bir sitede bekçilik yapan bir adamdır. Bir [PET_BOUNDARY]hayat kadınıyla[PET_BOUNDARY], onun AİDS olduğunu bilerek beraber olur. Site yöneticisi hastalığını öğrenince işine son verir. O da ölümü beklemek yerine ölüme gitmeyi tercih eder. Deniz kıyısında bir çuval taşa bağlı şekilde hayatına son verecekken taş onu yeniden hayata bağlar. Dursun zamanla bir seri katile dönüşür. Bir süre sonra işlediği cinayetlerinde ona bir haz vermediğini anlar. Etiketler: seri katil , katil , bekçi , Bir ,",1
397,"Kütahya'nın Emet ilçesinde, iki aile arasında çıkan silahlı kavgada 4 kişi hayatını [PET_BOUNDARY]kaybetti[PET_BOUNDARY]. Alınan bilgiye göre, ilçeye bağlı Gürpınar köyünde, aralarındaki husumet nedeniyle iki aile arasında çıkan tartışma bir süre sonra kavgaya dönüştü. Silahların da kullanıldığı kavgada 1'i kadın 4 kişinin öldüğü öğrenildi. Olayın ardından bölgeye çok sayıda jandarma ekibi ve ambulans sevk edildi.",1
1196,"ile karşılaşınca kendilerini değersiz ve aşağılanmış hissederler. Hamile kaldığınız günden itibaren genç kızlık [PET_BOUNDARY]hayatına veda ettiğinizi[PET_BOUNDARY], dokuz ay sonra başınıza annelik tacı giydirileceğim seziyordunuz. Maalesef kadınların çoğu bu tacı layıkıyla",0
460,"Geçtiğimiz hafta Fenerbahçe'ye 2 penaltı golüyle [PET_BOUNDARY]kaybeden[PET_BOUNDARY] Gençlerbirliği, Galatasaray'ı 4 - 0 gibi farklı bir skorla mağlup eden Başakşehir'i konuk etti. Ankara temsilcisi 3 puana, Tomic'in 90+6'da frikikten attığı golle uzandı. Ligin tek namağlup takımı olan Abdullah Avcı'nın öğrencileri, bu ünvanını Başkent deplasmanında korumayı başaramadı. Bu sonucun ardından Gençlerbirliği puanını 11'e yükseltirken, konuk Başakşehir ise 11 puanda kaldı.",0
1023,"en yaygın şekilde kullanılan plastiklerden birisidir. Yüksek basınca dayanıklıdır ve yere düştüğünde patlamaz. [PET_BOUNDARY]Gaz kaçırmayan[PET_BOUNDARY] özelliktedir, bu nedenle gazlı içeceklerin gazını içeride tutar ve şişelenmiş içeceklerin lezzetini korur.",0
854,"olduğunu nereden, biliyorsun? Rus; – Kendisi bana söyledi, dedi, hatta öldürmeyip size götürmemi söyledi. Ben ise, [PET_BOUNDARY]işini bitirdim[PET_BOUNDARY]. Tokta, bu söz üzerine çok kızdı. Böyle büyük şerefli insana saldırarak kendisine teslim etmediği için Rusu öldürttü",1
642,"796110        Sevgili Demir Tiryaki'nin hazırladığı ""Bakterilerin hüzünlü öyküsü"", geçen yıl [PET_BOUNDARY]aramızdan ayrılan[PET_BOUNDARY] sıkı Ankemist Sinan Nur Kesim'in dağıttığı selpak mendilleri eşliğinde göz yaşlarıyla izlendi.",1
552,"CHP Elazığ İl Başkanı Ethem Gülbay, CHP Grup Başkanvekili Kemal Kılıçdaroğlu'nun  uzun süredir rahatsız olan, 88 yaşındaki annesi Yemuş Kılıçdaroğlu'nun  tedavi gördüğü Fırat Üniversitesi Hastanesi'nde [PET_BOUNDARY]vefat ettiğini[PET_BOUNDARY] söyledi. Gülbay, cenazenin bugün Tunceli'ye gönderileceğini, Kılıçdaroğlu'nun da bugün veya yarın cenaze için Tunceli'ye gideceğini kaydetti.",1
296,"Adnan Menderes Bulvarı'ndaki bir evden silah sesi gelmesi üzerine çevredekiler polise haber verdi. Eve giden polis, A.B'nin birahanede garson olarak çalışan, birlikte yaşadığı Bahar A'yı  (29) av tüfeğiyle vurarak öldürdükten sonra [PET_BOUNDARY]göğsüne[PET_BOUNDARY] ateş ederek intihar girişiminde bulunduğunu belirledi. Ağır yaralanan A.B, Bergama Devlet Hastanesi'ne kaldırıldı.",0
436,"İstanbul 9. Ağır Ceza Mahkemesi'ndeki dava için tutuklu bulunduğu Edirne F Tipi Cezaevinden adliyeye getirilen Nuri Ergin, cezaevi aracından indirilerek adliye nezarethanesine alınırken ""Veli Küçük'e söyleyin yürekleri varsa bize kendileri mesaj versin. Veli Küçük, akıllı ol. Ben [PET_BOUNDARY]kaybedecek[PET_BOUNDARY] maça oynamam"" diye bağırdı.",0
495,"İtalyan La Repubblica gazetesinde yer alan habere göre, aşırı yaşlılıktan artık hiç hareket edemez hale gelen 3,5 yaşındaki Heidi, daha fazla acı çekmesini istemeyen bakıcıları tarafından [PET_BOUNDARY]uyutuldu[PET_BOUNDARY]. İnternetteki bir sosyal paylaşım sitesinde görüntülerinin yayımlanmasının ardında bir dünya yıldızına dönüşen sevimli hayvan, oyuncaklara ilham vermiş, hatta Oscar töreninin ""şeref konuğu"" olmuştu.",1
