text,label
But I think we have some unique capabilities that could be even more effectively explored. We buy a lot of health commodities for [PET_BOUNDARY]low-income[PET_BOUNDARY] communities and low-income countries. They range from contraceptive commodities to malaria drugs to vaccines for children.,1
"He had put in almost 20 years at NBC, devoting himself body and soul to the network and its needs, and now he was being told-- in effect-- that soon they would be posting his picture on NBC's properties with orders to give him the bum's rush if he ever showed his face. He recalled how, when his Late Night finally burst through in the ratings and with the press, and all the heat it generated was pumping cash into the basement at 30 Rock, NBC came and asked him what kind of gift they could give him-- probably [PET_BOUNDARY]expecting[PET_BOUNDARY] he'd say a Porsche or a yacht. Instead @ @ @ @ @ @ @ @ @ @ vintage microphone hanging around somewhere. ",0
"but technically, McQueen appropriated the kimono for his high fashion style so whether or not Bjork wore an original one or not isn't the point, the point was more like, why are we giving her (and I guess McQueen by extension) a [PET_BOUNDARY]pass on[PET_BOUNDARY] the ""appropriation front"".",0
Another fellow graduate student (a married male) was heard in the student lounge bragging about how many female undergraduates he planned to [PET_BOUNDARY]sleep with[PET_BOUNDARY] now that he was going to be a teaching assistant.,1
"filipkowski closed the company's california office in , bringing only his brother-in-law, the vice president of business analysis, across the country to the virginia office, and this year, he [PET_BOUNDARY]laid off[PET_BOUNDARY] another % of firetide's workforce.",1
Give away the stone. Let the oceans take and transmutate this cold and fated anchor. Give away the stone. Let the waters kiss and transmutate these leaden grudges into gold. [PET_BOUNDARY]Let go[PET_BOUNDARY].,0
"Ummm, economy collapsing, re-election campaigns, Obamacare, ending DADT, and yeah, Shyne. Please @ @ @ @ @ @ @ @ @ @ I'd wish you'd [PET_BOUNDARY]lay off[PET_BOUNDARY] the political blinds, for both parties. It just adds nonsense on top of the already steaming pile of nonsense that is the political arena. ",0
"but, bucky was feeling the pain again just a few weeks before the huskies'  fall camp was to start. he decided not to go to the hospital and tough it out for two days. the second day, bucky, , went to [PET_BOUNDARY]sleep around[PET_BOUNDARY]  p.m. and didn't wake up.",0
"In 1980-82, Dr. Singh said, people in the most affluent group could expect to live 2.8 years longer than people in the most [PET_BOUNDARY]deprived[PET_BOUNDARY] group (75.8 versus 73 years). By 1998-2000, the difference in life expectancy had increased to 4.5 years (79.2 versus 74.7 years), and it continues to grow, he said.",1
"As it happens, the ""Rolling in the Deep"" singer took to her blog on June 29 to announce that she and her 36-year-old charity-entrepreneur beau were [PET_BOUNDARY]expecting[PET_BOUNDARY] their first child, although she kept the details on their happy announcement to a bare minimum and notably did not disclose when, exactly, she was due or how far along in her pregnancy she was ##214950 ",1
"The crippled scientist begs them to have pity, but that word is not in the Daleks' vocabulary. Davros then screams in agony and tells the Daleks that they must and will obey him. @ @ @ @ @ @ @ @ @ @ decides to destroy the Daleks by pressing a red button, but the Daleks see what he is doing, and they [PET_BOUNDARY]exterminate[PET_BOUNDARY] him. The lead Dalek proclaims that, despite their entombment, this is only the beginning. ",1
"Christians in America don't seem to think that way, but they should. They have to realize who is making it possible for Israel to receive so much aid from America and not be a second class or newly [PET_BOUNDARY]developing country[PET_BOUNDARY]. ",1
"There's no difference. [PET_BOUNDARY]Terminating a pregnancy[PET_BOUNDARY] is murder. I'm sorry the mother might have been raped, just as I hate it that some people have cancer and heart attacks and strokes.",1
"Several of the dead were killed in the rubble of buildings that collapsed in the fury of the massive storm. Nine people died in Santiago, including a four-month old infant who was among four people who [PET_BOUNDARY]perished[PET_BOUNDARY] when a house caved in. Five more people in the province died during the storm for unspecified reasons. ",1
"Wu Chien Lung, I notice how well you write in English so you are definitely Western educated, if not born, and I appreciate your perspective related to addressing energy concerns in the West, not least because of the continued explosion of population in the developing world, already [PET_BOUNDARY]deprived[PET_BOUNDARY] of energy and needing so much more if population predictions are correct acknowledging that the new driver of global growth should be in a Green Economy; securing energy, food and water security especially in the developing world.",0
"""The level of concern has been growing"" with the new revelations about viral spread, said Marc Lipsitch of Harvard's School @ @ @ @ @ @ @ @ @ @ least 14,000 people since it was first detected in central China in [PET_BOUNDARY]late[PET_BOUNDARY] December. It has killed more than 300 and spread to about two dozen countries although most, like the United States, have few cases. ",0
I have seen amazing tremendous transformations in all scopes in Poland since I came before the end of the 90s. The amazing democratic transformations that had taken place over the past 20 year generally in Eastern @ @ @ @ @ @ @ @ @ @ the deep changes within the macro-social system and the subsequent political and [PET_BOUNDARY]economical[PET_BOUNDARY] transformations. Today the Polish economy has become one of the most dynamically developing ones in Europe.,0
"cormac mccarthy commands the page with a lyrical style, originality and language his own trademark like that of another great writer that comes to mind who has [PET_BOUNDARY]expired[PET_BOUNDARY] but voice alive in his works, william faulkner. the author is a genius, a true understander and writer of the plight of the men, tragedy, love and war, hopes and fears upon this terrible beauty a dwelling place on borrowed time for us and those characters contained in' the road.'",1
"Now when Simon saw that the Spirit was bestowed through the laying on of the apostles' hands, he offered them money, 19 saying, "" Give this authority to me as well, so that @ @ @ @ @ @ @ @ @ @ Holy Spirit. "" 20 But Peter said to him, "" May your silver [PET_BOUNDARY]perish[PET_BOUNDARY] with you, because you thought you could 22 obtain the gift of God with money! 21 "" You have 23 no part or portion in this e matter, for your heart is not ",0
"Nothing special in the works, probably just haunt this place per usual. The return has been generally quite good, though there are recurring issues that are often ugly (e.g., her foot-dragging on [PET_BOUNDARY]seeing someone[PET_BOUNDARY] to help her process the burning pit of anger she's carrying) But today we worked hard together for 5 hours or so and it was good. Oh, and as to the IBW, no, we're in the ozarks not the delta.",1
"Implementations that do not support scripting (or which have their scripting features [PET_BOUNDARY]disabled[PET_BOUNDARY] entirely) are exempt from supporting the events and DOM interfaces mentioned in this specification. For the parts of this specification that are defined in terms of an events model or in terms of the DOM, such user agents must still act as if events and the DOM were supported. ",0
Stargate Atlantis: If Carson Beckett's untimely [PET_BOUNDARY]demise[PET_BOUNDARY] doesn't count then nothing does. Some random Alien device that causes anyone affected by it to grow a rather malignant exploding tumor was found and activated by two unfortunate no-names.,1
"As soon as Romney decided he had lost, he [PET_BOUNDARY]pulled the plug[PET_BOUNDARY] on everything. I read that the campaign credit cards of his staff were cancelled election night leaving bills and return home. I wonder if leaving up the transition site wasn't part of this. It was set to go up at a certain time and went up. Only there wasn't anyone around with any interest, now that their credit cards had been cancelled, in taking it down.",0
"Our United Methodist Church is in the midst of an identity crisis. We have always talked gladly about becoming a ""global church"" but now that the African branches of the UMC are out-pacing the U.S. branches, we are not sure how to handle that global shift. We celebrate their growth, but we are reluctant to [PET_BOUNDARY]let go of[PET_BOUNDARY] our own power to control decisions for the denomination.",0
"But Hunt, speaking before the lockdown was announced, said the UK needed to introduce testing as well as new social distancing rules, warning that up to a million people could be infected by the end of next week and said the UK lockdown may be ""too [PET_BOUNDARY]late[PET_BOUNDARY]."" ",0
"Once your immune system is compromised, you'll come down with the flavor of the month, and then they got you. The medical profession and big pharma will then milk you and your bank account dry while treating the symptoms until your [PET_BOUNDARY]demise[PET_BOUNDARY]. Unless of course your a millionaire that can PAY FOR THE CURE. ",1
"i'll be waiting for you on judgment day to watch all these judgments [PET_BOUNDARY]pass away[PET_BOUNDARY] and by the way the details fall, by the way",0
"He is our Jehovah Jireh, our great provider! What kind of personal realtionship would we really have with Him, if we were living with easy [PET_BOUNDARY]economical[PET_BOUNDARY]/socially acceptable times? Really? ",0
""" Testing is everything right now, and the lack of widespread testing is making it very hard to grasp what's happening, particularly at the county levels @ @ @ @ @ @ @ @ @ @ Friday that if area residents continue to comply with stay-at-home orders and other restrictions, the regional spread of the coronavirus could slow by mid-to-[PET_BOUNDARY]late[PET_BOUNDARY] April. She said she talked with the heads of the area's three major hospital systems Thursday. ",0
"""Ashamed to be British right now. Springsteen and McCartney playing' Twist &; Shout' in Hyde Park and council [PET_BOUNDARY]pulled the plug[PET_BOUNDARY] cos of curfew,"" tweeted actor and comedian Stephen Merchant.",0
"I relent, [PET_BOUNDARY]let go of[PET_BOUNDARY] the rope. "" Listen, I will say this. I am aware that you guys, all of my students at UVM, have very few black professors. I am aware, in fact, that I may be the first black teacher many of you have ever had. And the way I dress for class reflects my awareness of that possibility it. No more.",0
"If the government's case was so ""ill-considered"" (and so deceitfully and maliciously ill-conceived as well, I might add), will they do the proper due process amends under the 1st Amendment in terms of redress of grievances and restore my name, integrity, expenses that made me [PET_BOUNDARY]indigent[PET_BOUNDARY], lost salary, pension, and also the good name and substance of the other whistleblowers related to my case ( Bill Binney, Kirk Wiebe, Ed Loomis @ @ @ @ @ @ @ @ @ @ other government employees and contractors, you don't hear about at all, who were harassed, intimidated, threatened, investigated, coerced, interrogated and even in some cases had their personal effects taken without warrants, or even lost their clearances because of the government's case against me and their personal or professional association with me? ",1
"I was homeschooled up until 5th grade, which is when I started attending a public elementary school, followed by a public high school for grades 7-12. I couldn't help but feel like I was in a school for the mentally [PET_BOUNDARY]disabled[PET_BOUNDARY] for most of my public school experience. Grammar, geography, the ability to do any sort of math without a calculator, foreign language, artistic talent, intelligent discussion, and the ability to effectively read, were all not very important whatsoever throughout my eight years of public education. ",1
those cheques issued by bhp billiton limited are paid to the victorian state government (registrar of unclaimed money) soon after months has [PET_BOUNDARY]expired[PET_BOUNDARY] from a specific dividend payment date.,0
"There is no better time to start thinking ""outside the box"" than when you're trapped in one! You are (no matter what the licensing boards say) @ @ @ @ @ @ @ @ @ @ career working with the [PET_BOUNDARY]disabled[PET_BOUNDARY] and recovering elderly, among others. Elderly, you hear me? ",1
"The average person might well ask, ""What's the problem? Why couldn't they just talk? "", and indeed, if the doctrine of the soul were true-if we all had a supernatural "" ghost "" in our heads, unaffected by physical brain damage, that directs our actions-this would be a valid @ @ @ @ @ @ @ @ @ @ and again that our consciousness and its attendant abilities are unified with the brain, and can be [PET_BOUNDARY]disabled[PET_BOUNDARY] by damage to it. In summary, "" the mind is the product of the brain's activities, and the brain's activities depend on its organization"" (p. vii). ",0
"what about the exhibits with [PET_BOUNDARY]expired[PET_BOUNDARY] bugs'more than bugs are mounted; most striking is a rainbow collage that features butterflies of every color. there's also a display that highlights multi-legged and, the cicada killer wasp and the european (don't be fooled by the name) mantis. more exotic specimens include the elephant beetle, the goliath bird-eating tarantula and the african emperor scorpion.",1
"Definitely, definitely. So let me address the ProAir question because it's an interesting @ @ @ @ @ @ @ @ @ @ that after Primatene Mist was approved in [PET_BOUNDARY]late[PET_BOUNDARY] 2018, in early 2019, the brands launched authorized generics. So technically, there have been generic albuterols on the market for over a year and really has not had impact to our product. ",0
"In the bunker, Davros vows ""revenge "" beginning with the "" Thal spy "" Ronson. With an order of "" [PET_BOUNDARY]Exterminate[PET_BOUNDARY]!"" from Davros, Ronson is shot down by the Daleks. Davros declares the death of the Kaled race and the rise of the Daleks as the supreme being and ultimate conqueror of the universe. ",1
"Also I notice that while Clinton is speaking the only time he glances away from the voter is when he takes a brief moment to close his eyes, as if he is looking' within' for the answer to come. Bush was glancing all about the room @ @ @ @ @ @ @ @ @ @ What really conveyed presence and sincerity to me was Clinton gesturing frequently with both his hands, literally tapping his [PET_BOUNDARY]chest[PET_BOUNDARY], clearly he was touching his own heart to convey the depth of his' feeling' and understanding, thereby touching the heart of the woman. Yes, he completely had the voter, and me! ",0
former pro bowl linebacker junior seau is the eighth member of the san diego chargers'  super bowl team to [PET_BOUNDARY]pass away[PET_BOUNDARY].,1
"""NFCTA"" may refer to the National Cyber-Forensics &; Training Alliance, a Pittsburgh-based non-profit organization that, in its own words, ""functions as a conduit between private industry and law enforcement with a core mission to identify, mitigate and [PET_BOUNDARY]neutralize[PET_BOUNDARY] cybercrime.""",0
"I would be more concerned, if I were you, with shows like Gossip Girl that turn young women into bitchy stereotypes with nothing to do but cut each other down and [PET_BOUNDARY]sleep with[PET_BOUNDARY] everyone in their school. Just saying...",1
"Later, a decadent couple pull into his shop needing car repair. They invite Alex and his [PET_BOUNDARY]mentally challenged[PET_BOUNDARY] buddy to join them at a decadent suburban party. Once there, Alex amuses himself by tormenting and raping the guests... Written by Ed Sutton  ",1
"Perhaps as many as 5,000 more people have been laid off since March, said one former employee who was [PET_BOUNDARY]let go[PET_BOUNDARY] in April.",1
"Does your software collect any information about me, my listening or my surfing habits? Can it be [PET_BOUNDARY]disabled[PET_BOUNDARY]? Is it going to install some inane and unecessary ""download manager"" which will play commercials without asking me while taking up loads of my precious screen real estate? ",0
"Stretching the season past [PET_BOUNDARY]late[PET_BOUNDARY] June is an option, but it gets complicated. Warmer weather and summer humidity make it difficult to maintain good ice, even in northern cities. ",0
It received 54' Likes' before they [PET_BOUNDARY]pulled the plug[PET_BOUNDARY]. I suppose the Senator just doesn't share my sense of humor...; - ),0
"She killed her 9 year old son Jack with her bare hands, and was determined to be clinically depressed, because HE had a new diagnosis of epilepsy. It was a crime against the [PET_BOUNDARY]disabled[PET_BOUNDARY], and she is out on the streets cured. ",1
"I am an almost 30 year old wife and mother to a baby girl in heaven, Tatum Cate, and to a new baby girl on earth, Callyn Joy. My husband and I were elated to find out we were [PET_BOUNDARY]expecting[PET_BOUNDARY] in October of 2007. I had a perfect pregnancy until 36 weeks, when we found out we had lost our little Tatum before she was even born. ",1
"1. Rifling and archedean screw- enhanced drag co-efficient spin. (The molecules on the outside of the flow attract to the pipe linig, barely moving along the surface, and that is what creates the vortex.) You can observe it every time you [PET_BOUNDARY]pull the plug[PET_BOUNDARY] on a sink or flush the toilet. Drag coefficients make it spin as it goes down the drain.",0
"Michael Vick benching rumors swilled for weeks. While Philadelphia Eagles coach Andy Reid could not [PET_BOUNDARY]pull the plug[PET_BOUNDARY] on Vick, for fear of losing his own job, the decision was made for him Sunday. Vick was knocked out of the Eagles game against the Dallas Cowboys after suffering a concussion. Prior to the concussion Vick had been a turn over machine for the Eagles who have now lost...",0
"Her reply was that yes, quite possibly for that much money, she might. Shaw then asked the woman would she [PET_BOUNDARY]sleep with[PET_BOUNDARY] him for the sum of five pounds. Certainly not! was her highly indignant response,' just what do you think I am,' she asked, as self-righteously insulted as she could bring herself to sound. ",1
"In many countries data are available on HIV prevalence among [PET_BOUNDARY]sex workers[PET_BOUNDARY]. However in estimating national HIV prevalence in countries with concentrated epidemics, the lack of information about the size of high risk populations is the limiting factor in producing reasonable estimates of the national HIV prevalence. ",1
"[PET_BOUNDARY]Late[PET_BOUNDARY] last October, I heard Mark Zuckerberg talk at Startup School 2011 about why he started Facebook. His message was that he didn't set out to start a company for the sake of it. ",0
"As far as Romney's bike riding in a suit, I see these young men every day. While I do not engage them, they are doing what they consider to be G -d's work, so [PET_BOUNDARY]LAY OFF[PET_BOUNDARY]. ",0
I'm gay and what I see in the photos is the same sort of physical intimacy I share with my friends. These aren't people I wish to [PET_BOUNDARY]sleep with[PET_BOUNDARY] -- just friends who are comfortable with each other. And if 5 of us cuddle up on a couch to watch TV that's okay.' taboo' of male intimacy we've been given societal permission to be physically comfortable. (scare quotes intentional).,1
"the eosInfo website says that it is NOT compatible with the canon EOS 500D, which also should be true, as canon has [PET_BOUNDARY]disabled[PET_BOUNDARY] the shutter count on 500D, and camerashuttercount.com says it has been tested with 500D but doesn't work for me, but how should it if canon does make that in the camera ##609640 ",0
I skipped the election coverage last night. Went to [PET_BOUNDARY]sleep with[PET_BOUNDARY] the girls instead and actually got the coffee rolling this morning before I even turned the T.V. on. I'm happy the election is over and hope to see the partisan gap close as we all work together for our country.,0
"you may have recently heard about the option of life settlements, where you sell your life insurance policy to a third party, and be considering this option in order to fund assisted living. the buyer of the policy takes responsibility for the premiums, and then receives the benefit when you [PET_BOUNDARY]pass away[PET_BOUNDARY].",1
"The issue of what happened in 2004 is not an academic one. For the second election in a row, the president of the United States was selected not by the uncontested will of the people but under a cloud of dirty tricks. Given the scope of the GOP machinations, we simply can not be certain that the right man now occupies the Oval Office -- which means, in effect, that we have been [PET_BOUNDARY]deprived[PET_BOUNDARY] of our faith in democracy itself.",0
"Kathie brought over our new cover, can you stand it?! I would [PET_BOUNDARY]sleep with[PET_BOUNDARY] it if I could but I'm a drooler.: ) I spent the morning with Sarah Bork Hamilton doing a Ruby and Esme photo shoot. Sarah, we thank you from the bottom of our toes up through our hearts for taking the time to give us your beautiful eye. Thursday, October 2, 2008",0
"I think a stronger message would be ""Because I was wrong/misled, I will fight harder than anyone to correct that mistake and end the war. "" More of a "" This time it's personal"" tone. I was simply suggesting a way to take that vote and make it a positive, as well as [PET_BOUNDARY]neutralize[PET_BOUNDARY] Sen. Obama's advantage in the situation. ",0
"As we wrote about earlier this week (here), on Tuesday, March 24, the U.S. Department of Labor (""DOL"") issued guidance regarding the Families First Coronavirus Response Act (""FFCRA"" or ""the Act"") in three parts: a Fact Sheet for Employees, a Fact Sheet for Employers, and a Frequently Asked Questions document. [PET_BOUNDARY]Late[PET_BOUNDARY] in the evening on Thursday, March 26, the DOL supplemented that guidance by adding twenty-three new ""Frequently Asked Questions"" (numbers 15-37). The DOL also issued a separate set of ""Frequently Asked Questions"" related to the notice posting requirements of the FFCRA. ",0
"During this five-lesson series, participants will have an opportunity to reflect on God's Purpose for their life by documenting their lineage/heritage and write a short, fun life-narrative that can be [PET_BOUNDARY]passed on[PET_BOUNDARY] to someone in their family. These will be family stories that should be passed on to the next generation -- stories that could be lost forever if they are not documented.",0
"SHELIA DENISE MCFADDEN TURBEVILLE-Shelia Denise McFadden, 46, died on Monday, March 30, 2020, at MUSC Health, Florence. She was born on March 22, 1974, in Lake City, a daughter of the [PET_BOUNDARY]late[PET_BOUNDARY] Willard D. McFadden and Barbara Ann McFadden. The family is receiving... @@84488941 Purdue is freezing merit pay increases ",1
"And is it not manifest what must needs be, and what really are, the effects and fruits hereof? Do not hereon multitudes [PET_BOUNDARY]perish[PET_BOUNDARY] for want of knowledge and continue in the ways of sin because they have none to teach them better, at least none to teach them on such principles as are alone effectual unto their conversion and holiness? They must die, they shall die in their sins, but the blood of their souls will be required at other hands; for all the causes of gospel holiness, all proper motives unto it, all effectual ways and means of attaining it, are hid from them. ",0
"He said the situation in Kaura Namida is especially worrisome considering the increased number of people dying of recent in the area, including its paramount monarch. He said the family of the [PET_BOUNDARY]late[PET_BOUNDARY] Emir has been quarantined and fumigation of the Palace and major areas of the city has equally been done. ",1
"And since we (n.america ) don't live in democracys but some sort of corporate oligarchies ( I'm open to a better description ) What power to change policy do any of us really have? From my perspective we are back to the monkey trap, refusing to [PET_BOUNDARY]let go of[PET_BOUNDARY] the apple. As I understand your conception of collapse there will be communities that are forward thinkers who will step down ( roll with the punches) better than others. ",0
"Not for long. With the [PET_BOUNDARY]demise[PET_BOUNDARY] of the GOP, the next generation of American do not give a rat's a** about Israel. You guys better strike peace with your neighbours soon. ",0
"What can I do if 1 of my competitors spent a few thousand dollars on paid blog links that had my site url on it, then reported me to jump to number 1 in the rankings. Our old SEO now works for them (We [PET_BOUNDARY]let him go[PET_BOUNDARY]), &; I know something is severely wrong. This penalty just happened about a week ago, but has cost our company its top landing page (80,000 views a month).",1
He could be doing much better. He's letting Obama [PET_BOUNDARY]neutralize[PET_BOUNDARY] a winning issue for the Republicans.,0
After feeding all the animals I spent a good amount of time digging up all of our yellow and purple onions that we had cared for over the past 90 (rough estimate of time) days. I hung them over the fence to dry and quickly moved into planting the second set that I hope to have harvested before the icy cold fingers of winter step in and [PET_BOUNDARY]put to sleep[PET_BOUNDARY] the growing season of 2012.,0
