text,label
"Calves and baby goats were sheltered in the front rooms of tiny domed three-room huts in which the Masai family lived. The other two rooms were the father's sleeping cubicle aid a smaller one for the mother, who [PET_BOUNDARY]slept with[PET_BOUNDARY] the children. Mud, grass and cow dung @ @ @ @ @ @ @ @ @ @ floor. ",0
"That was really bad for public health. In Nigeria, that situation was what obtained before a United States financial expert of Liberian extraction, the [PET_BOUNDARY]late[PET_BOUNDARY] Patrick Sawyer, brought Ebola disease into Nigeria while seeking a cure. When the disease came and it became clear that the only way out was to embrace preventive measures towards containing its spread among the people since it had no cure, efforts were made, for the first time in the history of the country, to remember and embrace preventive measures in containing the spread of Ebola. ",1
"Unfortunately, I didn't have a lot of information about the circumstances or problems that lead to the husband moving out or what he said when he did, but it's my belief that just because one spouse moves out, this doesn't necessarily mean that the marriage is over or that you have to just [PET_BOUNDARY]let go[PET_BOUNDARY] immediately. I will discuss this more below.w",0
"dear skirt: i like you quite a bit, but you gave me a mini heart attack when i tried you on. you see,i'm a leeeetle embarrassed of what size you actually are. so either i have to [PET_BOUNDARY]lay off[PET_BOUNDARY] the potato chips and fro yo... or i could just keep living in denial and blame it on the fact that you ""run small."" yeah... that sounds about right: )",0
"Again, not wanting to [PET_BOUNDARY]sleep with[PET_BOUNDARY] or be in a relationship with someone because they've surgically altered their genitals does not automatically that person transphobic. Even though the transsexual person is by all means a real woman or man, the fact still remains that not everyone wants to fuck/be with someone who was not born a biological female/male. HOW DARE THEY!!!",1
"c'm on guys, [PET_BOUNDARY]lay off[PET_BOUNDARY]. it was a mistake. my family told me i was cherokee. honest... uh... whatever.",0
"""They are guiding all of our practices. They are literally, every single day, as [PET_BOUNDARY]late[PET_BOUNDARY] as last night, emailing me and texting me and preparing us for any changes,"" Tabak said. "" We also get regular communication directly from the CDC, the Centers for Medicare &amp; Medicaid Services, and the state and county health departments. ",0
"When my wrist bones were broken last February I had to go to the operation room for a procedure, to set the bones in the right place. Before that the doctors wanted 3 test reports, = blood, ECG, and [PET_BOUNDARY]chest[PET_BOUNDARY] X-ray. The xray report said COAD (Chronic Obstructive Air-wave Disease). ",0
"A fellow mother and law-school graduate sent me this quandary. I feel her intense frustration in her words, which I take not as a judgment of others, but of herself and her own particular choice. Does anyone have advice about how to restart a career in an economy that is particularly punishing for those who voluntarily [PET_BOUNDARY]pulled the plug[PET_BOUNDARY], or how to cope with the feeling of having sabotaged yourself, as you search for a way to make it all work out?",0
"As well, please note that I will not be attending on Tuesday. Prior practical suggestion about how resident input at City meetings could be made fairer and more everyone-helpful, has apparently been [PET_BOUNDARY]dismissed[PET_BOUNDARY]. So, sans opportunity for meaningful discussion about this matter, there seems now no point in attending. ",0
"The recent availability of ultrasound imaging permits early diagnosis of cervical ectopic pregnancy. Several conservative methods for [PET_BOUNDARY]pregnancy termination[PET_BOUNDARY] have been suggested to avoid bleeding, preserve the uterus, and maintain fertility. Currently, the standard treatment of cervical ectopic pregnancy with bleeding includes systemic or local administration of methotrexate (MTX) with or without additional therapeutic procedures such as dilatation and curettage followed by intracervical balloon blocking, uterine artery embolization (UAE) or ligation, or even cervicotomy 3.",1
Don't have a peaceful place to stay Let all fighting cease that your children may see peace Wipe their tears of sorrow away ( chorus ) To believe in a day When hunger and war will [PET_BOUNDARY]pass away[PET_BOUNDARY] To have the hope amidst despair That every sparrow's counted That you hear each cry and listen to each prayer,0
"The report pointed out that since 2008 alone, 21 formal complaints have been brought by communities affected by Bank investments that they say have violated their land rights. It also emphasised that while responsibility for land-grabbing lied with many actors-- from developing and [PET_BOUNDARY]developed country[PET_BOUNDARY] governments to private investors-- the World Bank had more influence to' change the terms of the debate'. ",1
"All the Way: A Decade of Song songs I just want to say, this is one of the best CDs to buy. I am so happy to know she and her husband are [PET_BOUNDARY]expecting[PET_BOUNDARY] a child. They deserve it. ",1
"what a ridiculous comment, tony. your comment suggests that anyone who disagrees with obama even on one issue is a racist and that is wrong. americans have the right to disagree with any administration. remember those famous words'they came from hilary clinton. do the country a favor and [PET_BOUNDARY]lay off[PET_BOUNDARY] the obama koolaid, pal.",0
Even though they are on separate ships it all still goes wrong @ @ @ @ @ @ @ @ @ @ Shaw manages to walk straight on to another ship and took off so I'm guessing the same happened to them ). Also if they really were intending to destroy humans (again only implied by character) then why did that engineer go after Shaw at the end when he [PET_BOUNDARY]let her go[PET_BOUNDARY] previously? Surely he would have just boarded another ship and continued on with his mission?,0
"Ed Smith is an African-American alderman who's represented the West Side for 20 years. ""It was a divided constituency when the younger Daley came in,"" says Mr. Smith. ""He had to really work, especially since Harold the [PET_BOUNDARY]late[PET_BOUNDARY] former mayor Washington was so well-loved, so gregarious. This mayor was a little subdued."" ",1
"The [PET_BOUNDARY]mentally challenged[PET_BOUNDARY] girl in the Glen Ridge, NJ gang rape case had her medical and psychiatric records rifled through by the defense, who kept throwing up things she said in therapy during cross examination to prove that a teenager with the mental capacity of an 8-year-old was a ""slut"" and a ""pig"" (his words) and therefore wanted to be raped with a baseball bat and a pool cue. ",1
"Years later, we can look back with mixed reaction. [PET_BOUNDARY]Low-income[PET_BOUNDARY] housing continues to lag behind the need, as it does everywhere in the nation. The county's general plan update is meant to address some of this problem in the coming years. ",1
"Wow! I really admire your style! Talking about ""the [PET_BOUNDARY]time of the month[PET_BOUNDARY]"" with confidence on your blog is very inspiring! You wear your white pants like it won't affect the situation!",1
"Mace's book is illustrated with sketches by the [PET_BOUNDARY]late[PET_BOUNDARY] Joseph Astarita, of Brooklyn, N.Y., a fellow civilian construction worker listed among the Morrison-Knudsen crew who became a POW along with Mace. @ @ @ @ @ @ @ @ @ @ 1947, documented the battle for Wake Island, including the Japanese capture of the Americans and the transfer of the survivors by prison ship. ",1
"One windy day, the sea flooded the port city of Dwaravati. All its occupants [PET_BOUNDARY]perished[PET_BOUNDARY] except Krishna, an avatar of Vishnu, and his brother Balarama, who were walking in the forests of Raivataka Hill. Krishna left his brother alone. ",1
"I kneel and just use the main facuet, not the shower. I pure the cold water over me quickly and breathe out when I do so, [PET_BOUNDARY]chest[PET_BOUNDARY], back and head. I also have found a @ @ @ @ @ @ @ @ @ @ The salt dissolves and I get the feeling the salt water conducts the energy flow around my skin better. ",0
"I'm now convinced that my friend, lawyer Gary Welsh of Advance Indiana, who has excellent instincts, was correct. @ @ @ @ @ @ @ @ @ @ link from a comment at the bottom which took me to a series of Youtube videos connected to one Alan Sabrosky trying to blame 9-11 on Israel and the Jews. His credentials are apparently well connected and the commenters following him wish to [PET_BOUNDARY]exterminate[PET_BOUNDARY] the jews. He is also said to be a Jewish ex marine and former director of the army war college. ",1
"the excitement, such as it was, over basil hallward's disappearance would soon [PET_BOUNDARY]pass away[PET_BOUNDARY]. it was already waning. he was perfectly safe there. nor, indeed, was it the death of basil hallward that weighed most upon his mind. it was the living death of his own soul that troubled him.",0
"A good and scriptural description of forgiveness that includes the need for repentance. To my understanding, repentance is not just saying, and turning away from it. The victims can and probably should [PET_BOUNDARY]let go of[PET_BOUNDARY] their pain when able but Holmes himself can't truly be forgiven for what he's unwilling to take responsibility for.",0
"A former mechanic, McFoy went back to school at Davidson County Community College to learn @ @ @ @ @ @ @ @ @ @ from DCCC by 2014, started working as a machinist for Special Fab and Machine Inc. in Lexington about a month ago. He's loved every minute of it, he said. ""When I got [PET_BOUNDARY]laid off[PET_BOUNDARY], I wanted to try something different,"" McFoy said. "" Now, I'm hooked. Sure, it's work, but it's fun. ",1
"Last week a federal judge [PET_BOUNDARY]dismissed[PET_BOUNDARY] a lawsuit against the Drug Enforcement Administration by Lee Paige, the DEA agent who literally shot himself in the foot with an allegedly unloaded gun while talking about firearm safety to a roomful of Florida children-- right after announcing, ""I'm the only one in this room professional enough... to carry this Glock 40. """,0
"For those unfamiliar with the term, the two-week wait is the time between ovulation and the beginning of a woman's next period. For women who are not trying to get pregnant, the two-week wait is as little noted as any other [PET_BOUNDARY]time of the month[PET_BOUNDARY]. For women who are trying to conceive, especially those who have been trying for a while, the two-week wait can seem like forever.",1
"this might not mean that jeep will [PET_BOUNDARY]lay off[PET_BOUNDARY] any workers in the us - it may want to just use the plants in italy to increase overall production for the north american markets, but it just as likely means that some jeep jobs will be lost in the us and will be replaced by the plants in italy.",1
"Hey FooFighter, I hope they [PET_BOUNDARY]pull the plug[PET_BOUNDARY] on you as soon as possible... You people are a bunch of fucking assholes talking about who should die. All of you here go fuck yourselves... I hope everyone of you die from some nasty ass bleeding disease. Bunch of fucking trolls.",0
"Jesus could not induct Himself into the office while here on Earth in human form. It was necessary for Him, as explained in the parable of the pounds (Luke 19), [PET_BOUNDARY]to go to heaven[PET_BOUNDARY] to there receive the authority of the Kingdom from God (the Father) -- and to be CROWNED! The coronation ceremony will take place in heaven at God's throne, before Christ's return in POWER and GLORY!",0
"I bet that we all will be studying these new options very closely. Many of us will be swayed to purchase one of the competitions vehicles. And there is nothing wrong with that. I have said myself that I will very likely purchase a new Honda or Prius this fall or early next year. But in 2011 or 2012 when the Volt gets to a dealer close to me, I will [PET_BOUNDARY]pass on[PET_BOUNDARY] to my wife the Honda or Prius and go shopping for a new Volt.",0
"Whites, too, have a right to exist. The primary duty you have as a human being is to preserve the heritage of your ancestors and [PET_BOUNDARY]pass on[PET_BOUNDARY] to your children a country they can call their own and where they can live in dignity.",0
"Eternal, Jehovah, Jesus Christ, Messiah, All-beautiful, All-true, All-holy! All-loving and All-merciful in the old and in the new covenant @ @ @ @ @ @ @ @ @ @ away, but my words shall not [PET_BOUNDARY]pass away[PET_BOUNDARY]. Thou hast said: I came not to destroy the old covenant, but to fulfill it.",0
"Finally, there are women who are ""blocked"" psychologically from experiencing orgasm. For some reason, at this time in their lives, they are facing situations or relationships where it may be difficult to [PET_BOUNDARY]let go[PET_BOUNDARY] or experience pleasure.",0
"ComNavFE's Operation Order 5-50, issued that evening, instructed the Seventh Fleet to conduct surface and air operations to [PET_BOUNDARY]neutralize[PET_BOUNDARY] Formosa. On the morning of the 29th, pursuant to these instructions, Admiral Hoskins made his presence felt by flying 29 F4Us and ADs up Formosa Strait. ",1
"""Noel Griffin, the ISPCA's chief executive said that his group's [PET_BOUNDARY]put to sleep[PET_BOUNDARY] figures were higher than other pounds because it does not give dogs to other welfare groups to rehome in Britain. He questioned how other Irish animal-welfare groups were managing to find homes for dogs that he said were of"" no value ""&;"" not the prettiest "". ",1
"But however this may have been, His intention in employing the term, hitherto used of the Hebrew people viewed as @ @ @ @ @ @ @ @ @ @ establishing can not be mistaken. It implied the claim that this society now constituted the true people of God, that the Old Covenant was [PET_BOUNDARY]passing away[PET_BOUNDARY], and that He, the promised Messias, was inaugurating a New Covenant with a New Israel. ",0
instead he is approaching it like a merger. telling the board how he is going to [PET_BOUNDARY]lay off[PET_BOUNDARY] people so who cares what they think about him now.,1
"Besides, the decision to [PET_BOUNDARY]pull the plug[PET_BOUNDARY] on Google's mapping database at the end of what was probably a five-year contract had to have been made while Jobs was running the company.",0
"Dear Reviewers, Stop [PET_BOUNDARY]expecting[PET_BOUNDARY] that every character in every movie will behave in exactly the way that you are expecting them to behave. This is a story about certain people, who make certain decisions, which have certain consequences. ",0
"Reason, however cultivated and improved, can not produce the love of God; which is plain from hence: It can not produce either faith or hope; from which alone this love can flow. It is then only, when we ""behold "" by faith "" what manner of love the Father @ @ @ @ @ @ @ @ @ @ Son, that we might not [PET_BOUNDARY]perish[PET_BOUNDARY], but have everlasting life, that "" the love of God is shed abroad in our heart by the Holy Ghost which is given unto us. "" It is only then, when we "" rejoice in hope of the glory of God, "" that "" we love Him because he first loved us."" But what can cold reason do in this matter? It may present us with fair ideas; it can draw a fine picture of love: But this is only a painted fire. ",1
"And from a Philosophical standpoint, also not certain that it is any worse of the Political Suicide Bombers in the world. I believe that the Bombers life would have be better utilized as a platform for transplant, than their chosen [PET_BOUNDARY]demise[PET_BOUNDARY]. The real issue is not Philosophical but Moral, and the only reason for even considering a Kidney donor from those incarcerated would be person wishes, given to somehow amelertate any perceived wrongdoing on the part of the Prisoner or whomever. ",1
"For example, setting the [PET_BOUNDARY]disabled[PET_BOUNDARY] attribute to the value ""false"" is disallowed, because despite the appearance of meaning that the element is enabled, it in fact means that the element is disabled (what matters for implementations is the presence of the attribute, not its value). ",0
"Regeneration is involved in pardon and justification. Old things have [PET_BOUNDARY]passed away[PET_BOUNDARY], and, behold, all things become new. The blind see, the lame walk, the deaf hear, the dead are brought to life. ",0
"Sidious, now scarred from the ""attempt on his life, "" took advantage of Skywalker's emotional distress and pressured him to turn to the dark side of the Force. Unsure what to do and feeling he could never be forgiven for what he had done, as well as desperate to save his wife Padm Amidala from the possibility of a presaged [PET_BOUNDARY]demise[PET_BOUNDARY], Skywalker complied and was "" knighted"" by Sidious as his new apprentice, Darth Vader, Lord of the Sith. Vader would have an important role to play in carrying out his new master's plan. ",1
"AT&T's; promise ""relies on a definition of broadband that does not nearly put our country on par with our global competitors, "" then-FCC Commissioner Jonathan Adelstein said, adding that the deal "" would have been substantially improved by the inclusion of more specific, quantifiable, and enforceable commitments for rural and [PET_BOUNDARY]low-income[PET_BOUNDARY] consumers."" ",1
"Well, unfortunately, I doubt that the story about this little girl with that horrible disease would have made the news if not for the Facebook issue. This story should have been just about Kathleen [PET_BOUNDARY]passing away[PET_BOUNDARY]. Instead they printed the information about the Facebook problems, and people are going to jump on that. ",1
"In all, four drivers would [PET_BOUNDARY]perish[PET_BOUNDARY] in the World Championship during the 1958 season. PatO'Connor would be the first to die as part of the World Championship. ",1
"In most of the cases where a farm worker has died, the employer was found to have repeatedly [PET_BOUNDARY]deprived[PET_BOUNDARY] farm workers from adequate water and shade in violation of state regulations. It is obvious that these bad employers prey on the state's inability to enforce the law.",0
"Suddenly, another Time Lord appears in front of him, who the Doctor realises intercepted the transmat beam he and his companions were riding to Nerva. The Time Lords have foreseen a time when the Daleks will [PET_BOUNDARY]exterminate[PET_BOUNDARY] the universe itself. They want the Doctor to travel back to the time of their beginning to avert their creation, make them less aggressive, or find some inherent weakness in their makeup. ",1
"If auto root update is [PET_BOUNDARY]disabled[PET_BOUNDARY], no attempt to retrieve the root is made. Therefore, the roots are not installed. ",0
"Accordingly, Justice holds the keys of retribution (reward and punishment ) that open the gates of the House of Light. In Fragment VIII, verses 15-16, the Goddess proclaims: ""Justice has not loosened the shackles of Being allowing it to be born nor to [PET_BOUNDARY]perish[PET_BOUNDARY], but holds it fast. "" And, the Goddess continues: "" her Justice's decision about these matters consists in this: it is or it is not."" ( 15) ",1
"The way forward that has worked the best when I have over-reacted is to [PET_BOUNDARY]let go of[PET_BOUNDARY] any redaction that is not who I am when I'm at my best. My baseline for ""my best"" are some pictures I have when I was a child - pristinely myself - naturally loving, full-on, and curious about everything.",0
"clearly, an avalanche of ""mistakes"" has led to this unfortunate ending. i genuinely believe that leigh never meant to disclose a live password, but this doesn't excuse his ignorance of basic security practices (passwords are secret: even if you think they have [PET_BOUNDARY]expired[PET_BOUNDARY], it's best not to assume, especially when international diplomacy is at stake). roughly outlined, the ""mistakes"" i have seen people claim are as follows:",0
"He wouldn't and couldn't make himself listen to any of it. If most of them are like this fellow, they'll just continue to live in their own little universe as it wraps itself tighter and tighter until it evaporates like a small black hole when most of them [PET_BOUNDARY]pass on[PET_BOUNDARY]. The politics of spite is not a pretty sight. ",1
"Thank you, Rachel, for sharing your story. This September I was reminded of the importance of volunteering and performing random acts of kindness. Sept 12 would have been my friend's 23rd birthday. This year, instead of being sad that she's [PET_BOUNDARY]passed on[PET_BOUNDARY] from this world, we joined forces to spread random acts of kindness.",1
"as the volunteers worked, rosenblum met with an electrician and hvac contractor. they gave him estimates, but his cinderblock walls are still drenched. rosenblum is unemployed, a [PET_BOUNDARY]laid off[PET_BOUNDARY] computer programmer.",1
"And didn't you hear what the doctor said about why your tork is orange, cheetosdyk. Got [PET_BOUNDARY]lay off[PET_BOUNDARY] those things cheetosdyk. Tork the dork. ",0
"There are two very good reasons why the Knicks are knuckleheads for [PET_BOUNDARY]passing on[PET_BOUNDARY] Allen Iverson. For one thing, they've fallen completely off the radar in New York. ",0
"don't really see the problem, you were talking on a non-apple headphone and [PET_BOUNDARY]pulled the plug[PET_BOUNDARY] in the middle of talking. The phone then didn't register that, just pull the headphones out before you answer the call.",0
"My piece was superseded in the Fifteenth Edition (1974-1984) by a wise and comprehensive five-page article by the [PET_BOUNDARY]late[PET_BOUNDARY] Erwin Stengel, professor of psychiatry at the University of Sheffield. Its most innovative section is headed ""Suicide in the Future,"" and Stengel's predictions are not particularly rosy. ",1
"2010-2011: @ @ @ @ @ @ @ @ @ @ rebuilding process hit the rocks before it even got properly started as new coach Gasperini was [PET_BOUNDARY]dismissed[PET_BOUNDARY] already after three league matches into the season. This came as no surprise, though, as Inter's worst start in decades was not only represented by dreadful results (one point from a possible nine) but also by unbalanced performances. ",1
"2 ). I don't think we necessarily need 10, or whatever number, conservative networks. We just need several conservative to non-liberal networks to even the playing field. Fox alone can't [PET_BOUNDARY]neutralize[PET_BOUNDARY] the Liberal Media Complex.",0
"look, as i travel around the country, this is the issue that will break your heart over and over again. just yesterday, i was in toledo shaking some hands in a line. two women, both of them probably in their mid- to late-s, had just been [PET_BOUNDARY]laid off[PET_BOUNDARY] of their plant. neither of them have health insurance.",1
We do NOT need some self-imposed book cop telling us what to read or not to read. [PET_BOUNDARY]Lay off[PET_BOUNDARY]. Get over it.,0
"""A Dutchman without a pipe is a national impossibility. If a Dutchman were [PET_BOUNDARY]deprived[PET_BOUNDARY] of his pipe and tobacco, he would not even enter Paradise with a glad heart.""",0
"It's certainly a necessity if you have any intention of taking ""personal responsibility "" to eat healthfully, which conservatives claim to be a big fan of. Some people seem to think that if it's @ @ @ @ @ @ @ @ @ @ [PET_BOUNDARY]developing country[PET_BOUNDARY] can do without, it must not be a necessity. They completely ignore the fact that different societies have different "" necessities."" ",1
"the atlantic club [PET_BOUNDARY]laid off[PET_BOUNDARY]  workers, although three-quarters of those were seasonal jobs that would have ended anyway a bit later in the year. the storm forced the casino to end them earlier than it otherwise would have, chief operating officer michael frawley said.",1
"Because buying is among the stuff that consume the majority of the wedding ceremony spending budget, this will pay to possess wise as well as cost-effective buying strategies that won't depart your own wallet bare. Here are a few superb buying processes for the actual [PET_BOUNDARY]economical[PET_BOUNDARY] bride-to-be. ",1
This is a surprise given the low ratings of most NBC comedies. Cook may not be the sharpest knife in people do like him for whatever reason. I mean it must have been REALLY bad for them to have [PET_BOUNDARY]pulled the plug[PET_BOUNDARY].,0
", God is everything. People who believe that don't need admiration, they don't need to [PET_BOUNDARY]sleep with[PET_BOUNDARY] a man, they feel safe. But I can't invent a belief. ""? Graham Greene, The End of the Affair",1
"Thereafter, he visited him in London with his wife and children. But upon the [PET_BOUNDARY]demise[PET_BOUNDARY] of his father on 26 November, 2011, a meeting was convened by Professor Joseph Ojukwu with a view to reaching an amicable settlement as to who should control and manage the personal property owned by Ojukwu Transport which belonged to their grandfather, Sir Louis Ojukwu and the ones belonging to their father, Emeka Ojukwu. ",1
"If I type what I wish this govt for abandoning me God would punish me, so I will resist. I paid those premiums for TWENTY ONE years, until an unrelated surgery [PET_BOUNDARY]disabled[PET_BOUNDARY] me making me eligible for medicare &; disability at 63 years old. I will never forgive the medical profession, our politicians who did @ @ @ @ @ @ @ @ @ @ because I had had cancer which is the worst pre existing condition one can have. ",1
