text,label
"And then of course, there's Coming to America, perhaps the most obvious and influential modern-day embodiment of black America's @ @ @ @ @ @ @ @ @ @ roles he plays Prince Akeem, son of James Earl Jones' headstrong King Jaffe Joffer, ruler of the fictional nation Zamunda, and Queen Aoelon, gracefully portrayed by the [PET_BOUNDARY]late[PET_BOUNDARY] Madge Sinclair. Akeem shirks the tradition of arranged marriage set forth by his kingdom and takes a temporary vacation to America (Queens, New York, to be exact) in an attempt to find true love. ",1
The thing is now... @ @ @ @ @ @ @ @ @ @ think we can survive with only one income which is from my husband as he also has his family to support (his mum is a single mum with 2 schooling siblings and one [PET_BOUNDARY]mentally challenged[PET_BOUNDARY] sibling). We have lots of commitments to pay off and we don't even own a house yet!,1
"The estimated value of Japan's Mar. 11 material losses range from $235 billion to $309 billion. This figure doesn't take into account ongoing losses to crippled businesses-- the fishing industry, for instance, or the chilling effects of a [PET_BOUNDARY]disabled[PET_BOUNDARY] transportation system. Nor does it include the tainting of Japanese brands in the wake of the Fukushima Dai-Ichi nuclear plant meltdown, which may render Kobe beef as appealing as Chernobyl radishes. ",0
"Not all contact lenses are designed for overnight wear. Further, not everyone's eyes can adapt to this, even when using the proper lenses. Only an to sleep in contacts, and no one should [PET_BOUNDARY]sleep with[PET_BOUNDARY] their lenses in unless their eye care practitioner says it's okay.",0
"Asian workers and workers from non-English speaking background, because they hardly speak any English, often suffer the most: many are kept essentially incommunicado, are underpaid and are often [PET_BOUNDARY]deprived[PET_BOUNDARY] of their passports.",0
"""We don't have to [PET_BOUNDARY]let go of[PET_BOUNDARY] any story. The ego, the I, does not get in the way of being here."" Marilyn Schlitz",0
"Syd is in two minds about whether it's inherently confusing to grow up with a [PET_BOUNDARY]sex worker[PET_BOUNDARY] as a parent. "" I thought my mom looked pretty, like,' You're @ @ @ @ @ @ @ @ @ @ you. I've clearly done a lot of thinking about it. ",1
"Well, I don't think that a low self-regard is always a good thing, but it doesn't mean that a writer is [PET_BOUNDARY]disabled[PET_BOUNDARY], either. I suppose the greatest example of someone who thought he was no good in any way was Marcel Proust. ",0
"You can open them in Fireworks, Photoshop or your favorite graphics editor, design over them them, and save them back out as the same name. Most png files are png 32 as that creates perfect transparent edges.The main Firefox buttons are actually one big file that contains all the buttons, their rollover, pressed and [PET_BOUNDARY]disabled[PET_BOUNDARY] states too. Firefox then uses CSS to create the effects you see in the browser. ",0
"""You wait. They gon na get everybody on twitter, facebook, doing everythin' online and then they gon na [PET_BOUNDARY]pull the PLUG[PET_BOUNDARY] and we all gon na be FUCKED!""",1
"this very hearing proves the subversiveness, and hence the value @ @ @ @ @ @ @ @ @ @ remind us that the gleaming and heartless steel and glass structures of the state apparatus can one day [PET_BOUNDARY]pass away[PET_BOUNDARY]. it therefore creates an unconscious sense of opposition and hope.",0
Even Richard Nixon came to the realization that there was a time to negotiate and [PET_BOUNDARY]pull the plug[PET_BOUNDARY] on America's involvement in an otherwise endless war.,0
"Fourteen of Blanton's 22 homers allowed with the Phillies this @ @ @ @ @ @ @ @ @ @ Dodgers' interest in the trio of Philadelphia starters signals their intention to continue using their financial might as a means of upgrading, particularly now that the deadline has passed. Many players with large contracts are placed on waivers during August, and there's always a chance that if a team puts in a claim, the waiving team will [PET_BOUNDARY]let him go[PET_BOUNDARY] for nothing beyond the ability to clear his salary from the books. That's how the White Sox wound up with the Blue Jays' Alex Rios back in 2009; the outfielder was still owed more than $60 million. ",1
"Many were drowned in the flood. The whole of mankind would have [PET_BOUNDARY]perished[PET_BOUNDARY] if the pelican had not picked up survivors in his canoe. Roheim, p. 156; Gaster, p. 114 ",1
"[PET_BOUNDARY]Laid Off[PET_BOUNDARY] (pdf), a survey conducted by Francois Nel, in partnership with journalism.co.u k concluded that there are now between 30%-40% fewer jobs available for journalists than there were in 2001. Meanwhile, the number of students enrolling on journalism courses has gone up-- it is currently at its highest number and its highest proportion of all undergrad courses. ",1
"Third, evaluation of culture learning is a necessary component of the ""foreign culture curriculum,"" providing students with feedback and keeping teachers accountable in their teaching. A fourth point is made by Cruz, Bonissone, and Baff (1995) pertaining to the express need for linguistic and cultural competence as a means of achieving and negotiating nations' political and [PET_BOUNDARY]economical[PET_BOUNDARY] identities in an' ever shrinking world', as they put it. ",0
Their All-Star shortstop is out until September. Their highest-paid player just returned from a three-month stint on the [PET_BOUNDARY]disabled[PET_BOUNDARY] list and already had to miss a game because his legs were tired. And their staff ace is going to be shut down for the remainder of the season in about a month.,0
"Female Mastery for Men: Tristan Del Toro (definitely his real name) knows the three things every woman needs to know before she will [PET_BOUNDARY]sleep with[PET_BOUNDARY] you. This e-book costs4.95 ""for the first seven days of service"" plus a future payment of",1
"Within a family, children can easily take for granted and even in certain circumstances abuse their parents provisions. If parents effectively explain, reinforce and elaborate the reasons why the provisions are necessary the children are more likely to value the provisions. Not only value the provisions from their parents, but understand the importance of provisions so this practice becomes part of their lives and [PET_BOUNDARY]passed on[PET_BOUNDARY] to their children one day.",0
"In particular, one important task which the limbic system performs is to ""tag"" sensory input with emotional significance, enabling us to determine the meaning that a person or object holds for us. When this function is [PET_BOUNDARY]disabled[PET_BOUNDARY] by brain damage, the result is Capgras' syndrome, described in Part 2 of this essay. ",0
"five hundred years ago there was little light available in the evening. people generally went to [PET_BOUNDARY]sleep around[PET_BOUNDARY] dusk. researchers reviewed old books, documents and religious tracts. they discovered that people usually slept about four hours, woke up for  to  hours and went back to sleep for another four hours.",0
"We're [PET_BOUNDARY]expecting[PET_BOUNDARY] our second any day now (c'm on, kiddo!). Our first was a boy, and now we're going to have a girl-- so one of each! ",1
"The National Association of Hispanic Journalists says it will [PET_BOUNDARY]pass on[PET_BOUNDARY] condolences to Montao's family. In a press release, the National Press Club remembers a young man who ""visited the Club regularly and participated in our annual 5K run"" during an internship in Washington, ""where he spoke to the crowd of several hundred about what the National Press Club scholarship meant to him and his dreams of being a journalist. He showed a phenomenal amount of enthusiasm and was excited to start his career.""",0
"Handling was responsive but not squirrelly on everything from descents to dirt-road detours. And it managed to do all this while remaining comfortable, even after hours in @ @ @ @ @ @ @ @ @ @ an understated look-- ""when Jim Felt started building bikes in the [PET_BOUNDARY]late[PET_BOUNDARY]' 80s, everything was pretty much black,"" says Martin. But the details-- like the matching blue tires, aluminum headset spacer, and headset bolt-- add up to a clean, cohesive look.-- Emily Furia ",0
"Knopfler's fans are legion, as witnessed by the tally in the online voting, but the Cars had a better, more extensive catalog, at least in my judgment. Plus, as I said before, the ceremonies will be in Cleveland, and the [PET_BOUNDARY]late[PET_BOUNDARY] Cars bassist and singer Benjamin Orzechowski was born in Lakewood. It'll come down to one or the other, with the Cars in the driver's seat, so to speak. ",1
"How big your dating options are imo is @ @ @ @ @ @ @ @ @ @ to. I've seen people married to handicapped people, I've seen people married to ""little people"", I've known blind people that are married, and [PET_BOUNDARY]mentally challenged[PET_BOUNDARY] people married with children, and I know big full-figured people who are married. I know several interracial couples as well. ",1
"The markup is valid HTML5 and SEO optimzied, with all content always being available to search engines. When using this plugin, your page layout will be consistent even if javascript has been [PET_BOUNDARY]disabled[PET_BOUNDARY]. This slider includes a smooth and powerful Ken Burns effect which is completely configurable and compatible with all major browsers (including ie7 to ie9, Firefox Chrome, Opera, Safari) and mobile platforms like iphone/ipad. ",0
So @ @ @ @ @ @ @ @ @ @ that Crabs has taken it on board to solve both of those problems at the same time. Very [PET_BOUNDARY]economical[PET_BOUNDARY]. 49ers vs Rams: Post-game notes and transcripts. (Fooch),0
My son was born was eight weeks premature due to complications that arose during the later part of my pregnancy. I was told I would not be able to conceive prior to my pregnancy and when we found out we were [PET_BOUNDARY]expecting[PET_BOUNDARY] I was terrified and thrilled at the same time that God had blessed me. I was told at a routine exam there were complications and was sent to a hospital more equipped for to handle @ @ @ @ @ @ @ @ @ @ we were.,1
Pride filled me as I was [PET_BOUNDARY]passing on[PET_BOUNDARY] a true American tradition to my children. I have fond memories of ever so often finding Zingers in my lunch box in my grade school years.,0
"Done on a massive scale in Gravion' s backstory: In a land dispute between two planets, the rulers of one side reject Sandman's plan to use his Super Robot to build a new habitable world (or fix their old one) out of hand, and go with Hugi's plans to send an army of Robeasts and Mecha-Mooks to [PET_BOUNDARY]exterminate[PET_BOUNDARY] the people of the other planet ",1
"Her initial fear of commitment transforms into an ability to recognize and find love, even if it's short-lived. She goes through all the stages of grief associated with dying and is able to say her final goodbyes before finally [PET_BOUNDARY]passing away[PET_BOUNDARY]. Marley's best friends, Peter and Sarah, stand by her at every turn, even though Renee finds it too difficult (as a pregnant mother) to deal with the certainty of Marley's death. ",1
"Article 34 Citizens who have the right to vote and to stand for election and have reached to age of 23 are eligible to be elected presidents of people's courts or appointed vice-presidents of people's courts, chief judges or associate chief judges of divisions, judges or assistant judges; but persons who have ever been [PET_BOUNDARY]deprived[PET_BOUNDARY] of political rights are excluded.",0
"The past truly comes alive in this ambitious course, as Professor Garland takes a series of imaginative leaps to put you inside the world of history's anonymous citizens, providing you with a fuller understanding of the distant past. You'll see what daily life was like for workers, the poor, the elderly, the sick, the [PET_BOUNDARY]disabled[PET_BOUNDARY], refugees, women, children, slaves, and soldiers. Through the professor's engaging stories and with the aid of dazzling graphics, you'll experience the texture of daily life in these civilizations like never before-- and you'll be delighted by the ways you'll identify and empathize with people from another world. ",1
NextStep is a nationwide movement that aims to revolutionize the quality of healthcare for the [PET_BOUNDARY]physically challenged[PET_BOUNDARY] community. NextStep is a registered 501(c)3 non-profit organization. NextStep is a member of the Christopher and Dana Reeve Foundation NeuroRecovery Network (NRN) Community Fitness and Wellness (CFW) Program. For more information please visit - www.nextstepfitness.org/,1
"Lower-income and minority communities are often disproportionately affected by problems in the national economy, and the effects of the housing bust have followed that unfortunate pattern. Indeed, as a result of the crisis, most or all of the hard-won gains in homeownership made by [PET_BOUNDARY]low-income[PET_BOUNDARY] and minority communities in the past 15 years or so have been reversed.",1
"Why don't you ask those without healthcare or a job right now how much they care about your damn deficit? And, bitch about spending, but when the Bush tax cuts are to expire -- oh, don't touch them, huh? The wealthiest need their dough - their jumpstarting the economy, ain't they? Selfish, Un-American, Anti-Christian right need to be [PET_BOUNDARY]put to sleep[PET_BOUNDARY]. Bob Knutson 7.18.107:56PM",1
And that's how Homes of Hope India-U.S. -- a non-profit that raises money for the orphanage that inspired the idea -- was born. It started small -- raising money to buy foam mattresses and coverlets so the girls wouldn't have to [PET_BOUNDARY]sleep with[PET_BOUNDARY] only thin straw mats between them and the concrete floor.,0
"In sum, if it's really a burden on Melinda's daughter, she will pony up some money to get more socks. If it isn't and she can live with it, fine. Either way she makes a decision and learns that sometimes choices can have consequences. Either way, she is not being [PET_BOUNDARY]deprived[PET_BOUNDARY]. It's not a human rights violation to have only 3 pairs of socks and 3 pairs of underwear, not the last time I checked at least.",0
"To the fan, the game left the realm of ""just being a game"" when people started having a financial stake in the matter, especially during a recession when finances are tough enough. If I have roughly $600 dollars invested in my team (minimum, per season), I am [PET_BOUNDARY]expecting[PET_BOUNDARY] that the millionaires who get paid a heaping sum will perform their duties to a reasonable expectation. When the don't, I expect the @ @ @ @ @ @ @ @ @ @ that goal. ",0
"Another aspect that I have never seen written about, is all addictive substances (those that cause us to go through withdrawal) do carry over when we [PET_BOUNDARY]pass on[PET_BOUNDARY]. It is much more difficult to overcome these addictions ""on the other side"".",1
"He is being [PET_BOUNDARY]deprived[PET_BOUNDARY],' starved' if you will, of treatment that would give him a high probability of survival, without which, he has a very low (nearly non-existent) probability of survival.",0
"But after Doc was saved from the bullet, Marty got stuck facing off with Buford in a showdown, so then they had to leave before the showdown. Of course, considering Buford was sent to jail before they left, they could have [PET_BOUNDARY]pulled the plug[PET_BOUNDARY] on the whole thing at that point. Maybe since it was already the day at that point and they... I guess we'll just go through with it "".",0
"guy, [PET_BOUNDARY]lay off[PET_BOUNDARY] it.i'm choosing my words carefully. consider the report for what it's worth (i share the author's concerns), but don't say the report presents any credible news. ""a lack of water to the spent fuel pools was a major problem"" is untrue as far as anyone knows. posted by popular ethics at: pm on march , ",0
"Perhaps this is where the soul comes into play: Since one must have, according to Socrates, a soul to exist... and since all souls are created equal (like charge-positive, negative), then when one piles Sauron's inanimate soul (bound to a ring) on top of an animated soul (a living body), the two [PET_BOUNDARY]neutralize[PET_BOUNDARY] eachother, which manifests in the form of ""true"" invisibility.",0
"if rule xxii is continuously in effect, and does not [PET_BOUNDARY]expire[PET_BOUNDARY], how does one come to the conclusion that it applies on january th and every day thereafter, but there's something different about january rd'how does one come to the conclusion that there is hours in which now. does anyone care to answer my question?",0
"help. is anyone a medic, chris has an [PET_BOUNDARY]expired[PET_BOUNDARY] wfr, how high are we off the ground, feet, could i carry someone down from the base of the tower, do they have helicopters in moab yes they do because they sent one for aron ralston when he cut his arm off, how long does that take don't know what i can do for him.",1
"Exactly. Amy, River, and Oswin are all [PET_BOUNDARY]mentally challenged[PET_BOUNDARY] in some way, but in very different ways. Amy has her childhood attatchment to the Doctor and her alienation from society in general. ",1
"written by: amanda manago on november , this article has been read  times.life can be rough sometimes, but you have to push through the difficult patches and keep going we've been through rough patches in our lives. people we care about [PET_BOUNDARY]pass away[PET_BOUNDARY], tough choices turn up, breakups break our hearts and stressful situations",1
Suspense elements begin to emerge in the story when it looks like the pimp could get out of jail on a technicality involving an expert witness and then Heloise faces two blackmail threats-- from an old enemy and from one of her own [PET_BOUNDARY]sex workers[PET_BOUNDARY].,1
"February: (Again, gone, but for next year.) @ @ @ @ @ @ @ @ @ @ these in March if you want, and even April will have success in getting fruit. However, I like to eat tomatoes in [PET_BOUNDARY]late[PET_BOUNDARY] June and July when my cucumbers and salads are at their best. If you plant tomatoes in February, you are eating yummy, ripe tomatoes off the vine in the summer, and are less likely to have multiple boxes of green tomatoes in the fall ripening under your bed to escape frost and slugs! ",0
"the first to perish, according to forensics reports, was thibeaux-brignollel. within hours he was followed by kolevatov and dubinina. zolotarev would be the last to [PET_BOUNDARY]expire[PET_BOUNDARY] from a combination of the removal of dubinina's tongue occurred postmortem or if it contributed to her demise.",1
Tiffany makes a deal with him. She'll [PET_BOUNDARY]pass on[PET_BOUNDARY] a letter to Nikki if Pat promises to train and participate in a couples' dance competition Tiffany wants to enter. There is much more taking place in the movie as well... I'll just say that it all works together marvelously.,0
"VISION Community Services at the Massachusetts Association for the Blind provides services to people who are visually impaired. These services include a store of low vision aids and appliances, support groups, volunteer programs, Braille recording studios, and the Verizon Disability Phone Program, which provides phones to people who are legally blind, visually impaired, or [PET_BOUNDARY]hearing impaired[PET_BOUNDARY]. To learn more, call (617) 926-4232, or or visit the Web site at www.mablind.org",0
"When, during the speech, he belted out ""All Americans, male or female, young and not so young, black or white @ @ @ @ @ @ @ @ @ @ and not [PET_BOUNDARY]disabled[PET_BOUNDARY]"" I thought it was impossible. It's an action hero speech, a rah rah we defeated the aliens speech ...",1
Roger said that the money goes to all areas. Howard said he's going [PET_BOUNDARY]to go to heaven[PET_BOUNDARY] for that. Roger said he doesn't think so.,0
"So you admit it's transphobic, but think we should humor that transphobia to avoid consent issues. What's next, we should do a full ancestry research on ourselves before we [PET_BOUNDARY]sleep with[PET_BOUNDARY] someone to humor their possible racist fears?",1
"Opponents quickly organized, and launched the Proposition 8 initiative campaign, asking voters to ban same-sex marriages. After an expensive and hard-fought campaign, the measure [PET_BOUNDARY]passed on[PET_BOUNDARY] Nov. 4, 2008, with 52 percent of the vote. (Florida and Arizona also passed bans at the same time.)",0
The Romney campaign isn't dead it's just brain dead and the GOP will [PET_BOUNDARY]pull the plug[PET_BOUNDARY] on the day after the first debate. Obama won't get more than 365 electoral which was his total against the last guy you idiots swore up until the last hour was going to win big but he will get over 325 by our counting.,0
"I believe the entire anecdote was manufactured, and the wise, elderly black man who said he joined the campaign because of the girl was a convenient way to [PET_BOUNDARY]neutralize[PET_BOUNDARY] the angry elderly black man who is Wright. If the black person in that story had been a young male it would have sounded lewd, not touching.",0
"one point i don't understand: black's recommendation to replace every top banking regulator' ""other than"" sheila bair and the head of the sec.' of course this is all academic, but why not beheadings all around once we establish marshall law'the sec seems to be nothing but a goldman wall street protection racket. didn't they @ @ @ @ @ @ @ @ @ @, and still no criminal referrals'as someone else asked recently, when did eric holder [PET_BOUNDARY]pass away[PET_BOUNDARY]?",1
"more than a month away from election day, most of the work involves processing voter-registration applications and alterations, sohn said. after the deadline for registering [PET_BOUNDARY]expires[PET_BOUNDARY] days before election day, the focus changes to processing absentee ballots.",0
"... before dropping the extra cash. Was fully [PET_BOUNDARY]expecting[PET_BOUNDARY] something else with the IMAX screen. You're right Merrick about bruising the brand, because I said I wouldn't go to another IMAX movie, and told friends not to drop the extra $$$, wasn't worth it... ",0
"Not wanting anyone to be put out of business, but Missourians can ""buy"" their pets at the local animal shelter. At a much lower cost than from a pet breeder. And save many animals from being [PET_BOUNDARY]put to sleep[PET_BOUNDARY].",1
"By Season 4 and 5 (interestingly enough, it was around and Amy Roloff gained more power and achieved Executive Producer status, which they still have for the ""specials"" and for the ""Wedding Farm"" series), ratings for LPBW were dropping to the 1.2 - 1.0 level. Some episodes in Season 5 registered 1.0 and 1.1's. That's when TLC [PET_BOUNDARY]pulled the plug[PET_BOUNDARY] on the regular weekly LPBW series.",0
The [PET_BOUNDARY]late[PET_BOUNDARY] Gene Corrigan hired McGraw in 1987 to succeed Mary DiStanislao to take over a national afterthought of a women's basketball program a little over a year after he lured Lou Holtz to resuscitate the storied football program that had been relegated to a similar stature.,1
"Italy is experiencing its own version of the Terry Schiavo case. A woman, Eluana Englaro, was in a car crash 17 years ago that caused catastrophic brain damage -- she's been in a vegetative state ever since, and the family has been engaged in a legal fight for many years to [PET_BOUNDARY]pull the plug[PET_BOUNDARY] and allow her to die with a little dignity. They finally won that battle recently, and are easing her off life support and a feeding tube.",1
"For those who want to insist that' abuse' caused this, uhh, no it did not. She is the youngest of three children, she has been extensively psychoanalyzed and she is just [PET_BOUNDARY]mentally challenged[PET_BOUNDARY]. There is some speculation that she might have been denied oxygen at some critical formative point, but it is just speculation.",1
"Sleep-[PET_BOUNDARY]deprived[PET_BOUNDARY] workers may not know they are give a false sense of competency and security when, in fact, the brain's inconsistency could have dire consequences, "" Sleeping your way to success",0
"Moving forward, Butt said the government must intervene: ""We just have to look at what steps other countries have already announced to help retail businesses such as Government backed rental waivers, tax and utility waivers, interest free loans etc. Once business owners see that their losses have been reduced with government help then then no business would want to [PET_BOUNDARY]let go of[PET_BOUNDARY] their employees."" ",1
"(d) In the absence of other effective measures, the following procedures to safeguard the Fifth Amendment privilege must be observed: the person in custody must, prior to interrogation, be clearly informed that he has the right to remain silent, and that anything he says will be used against him in court; he must be clearly informed that he has the right to consult with a lawyer and to have the lawyer with him during interrogation, and that, if he is [PET_BOUNDARY]indigent[PET_BOUNDARY], a lawyer will be appointed to represent him. Pp. 384 U. S. 467-473. ",1
"""Better"" brains can improve their food and there-by increase the chance that they will [PET_BOUNDARY]pass on[PET_BOUNDARY] their genes; genes specifically tied to the ""better"" brain. The brain is the driving force in the equation.",0
